start_date,end_date,pollster,sponsor,sample_size,population,party,subject,tracking,text,approve,disapprove,url
2020-02-02,2020-02-04,YouGov,Economist,1500,a,all,Trump,FALSE,Do you approve or disapprove of Donald Trump’s handling of the coronavirus outbreak?,42,29,https://d25d2506sfb94s.cloudfront.net/cumulus_uploads/document/73jqd6u5mv/econTabReport.pdf
2020-02-02,2020-02-04,YouGov,Economist,376,a,R,Trump,FALSE,Do you approve or disapprove of Donald Trump’s handling of the coronavirus outbreak?,75,6,https://d25d2506sfb94s.cloudfront.net/cumulus_uploads/document/73jqd6u5mv/econTabReport.pdf
2020-02-02,2020-02-04,YouGov,Economist,523,a,D,Trump,FALSE,Do you approve or disapprove of Donald Trump’s handling of the coronavirus outbreak?,21,51,https://d25d2506sfb94s.cloudfront.net/cumulus_uploads/document/73jqd6u5mv/econTabReport.pdf
2020-02-02,2020-02-04,YouGov,Economist,599,a,I,Trump,FALSE,Do you approve or disapprove of Donald Trump’s handling of the coronavirus outbreak?,39,25,https://d25d2506sfb94s.cloudfront.net/cumulus_uploads/document/73jqd6u5mv/econTabReport.pdf
2020-02-07,2020-02-09,Morning Consult,"",2200,a,all,Trump,FALSE,Do you approve or disapprove of the job each of the following is doing in handling the spread of coronavirus in the United States? President Donald Trump,57,22,https://morningconsult.com/wp-content/uploads/2020/02/200214_crosstabs_CORONAVIRUS_Adults_v4_JB.pdf
2020-02-07,2020-02-09,Morning Consult,"",684,a,R,Trump,FALSE,Do you approve or disapprove of the job each of the following is doing in handling the spread of coronavirus in the United States? President Donald Trump,88,4,https://morningconsult.com/wp-content/uploads/2020/02/200214_crosstabs_CORONAVIRUS_Adults_v4_JB.pdf
2020-02-07,2020-02-09,Morning Consult,"",817,a,D,Trump,FALSE,Do you approve or disapprove of the job each of the following is doing in handling the spread of coronavirus in the United States? President Donald Trump,37,37,https://morningconsult.com/wp-content/uploads/2020/02/200214_crosstabs_CORONAVIRUS_Adults_v4_JB.pdf
2020-02-07,2020-02-09,Morning Consult,"",700,a,I,Trump,FALSE,Do you approve or disapprove of the job each of the following is doing in handling the spread of coronavirus in the United States? President Donald Trump,50,22,https://morningconsult.com/wp-content/uploads/2020/02/200214_crosstabs_CORONAVIRUS_Adults_v4_JB.pdf
2020-02-07,2020-02-09,Morning Consult,Politico,1996,rv,all,Trump,FALSE,"And, do you approve or disapprove of how each of the following have handled the response to the coronavirus? President Trump",39,35,https://morningconsult.com/wp-content/uploads/2020/02/200213_crosstabs_POLITICO_RVs_v1_AUTO.pdf
2020-02-07,2020-02-09,Morning Consult,Politico,700,rv,R,Trump,FALSE,"And, do you approve or disapprove of how each of the following have handled the response to the coronavirus? President Trump",71,8,https://morningconsult.com/wp-content/uploads/2020/02/200213_crosstabs_POLITICO_RVs_v1_AUTO.pdf
2020-02-07,2020-02-09,Morning Consult,Politico,788,rv,D,Trump,FALSE,"And, do you approve or disapprove of how each of the following have handled the response to the coronavirus? President Trump",15,60,https://morningconsult.com/wp-content/uploads/2020/02/200213_crosstabs_POLITICO_RVs_v1_AUTO.pdf
2020-02-07,2020-02-09,Morning Consult,Politico,508,rv,I,Trump,FALSE,"And, do you approve or disapprove of how each of the following have handled the response to the coronavirus? President Trump",34,33,https://morningconsult.com/wp-content/uploads/2020/02/200213_crosstabs_POLITICO_RVs_v1_AUTO.pdf
2020-02-09,2020-02-11,YouGov,Economist,1500,a,all,Trump,FALSE,Do you approve or disapprove of Donald Trump’s handling of the coronavirus outbreak?,39,28,https://d25d2506sfb94s.cloudfront.net/cumulus_uploads/document/79zfxkws33/econTabReport.pdf
2020-02-09,2020-02-11,YouGov,Economist,378,a,R,Trump,FALSE,Do you approve or disapprove of Donald Trump’s handling of the coronavirus outbreak?,74,7,https://d25d2506sfb94s.cloudfront.net/cumulus_uploads/document/79zfxkws33/econTabReport.pdf
2020-02-09,2020-02-11,YouGov,Economist,510,a,D,Trump,FALSE,Do you approve or disapprove of Donald Trump’s handling of the coronavirus outbreak?,19,50,https://d25d2506sfb94s.cloudfront.net/cumulus_uploads/document/79zfxkws33/econTabReport.pdf
2020-02-09,2020-02-11,YouGov,Economist,607,a,I,Trump,FALSE,Do you approve or disapprove of Donald Trump’s handling of the coronavirus outbreak?,33,25,https://d25d2506sfb94s.cloudfront.net/cumulus_uploads/document/79zfxkws33/econTabReport.pdf
2020-02-16,2020-02-18,YouGov,Economist,1500,a,all,Trump,FALSE,Do you approve or disapprove of Donald Trump’s handling of the coronavirus outbreak?,39,32,https://d25d2506sfb94s.cloudfront.net/cumulus_uploads/document/m3wzkd0n59/econTabReport.pdf
2020-02-16,2020-02-18,YouGov,Economist,381,a,R,Trump,FALSE,Do you approve or disapprove of Donald Trump’s handling of the coronavirus outbreak?,78,8,https://d25d2506sfb94s.cloudfront.net/cumulus_uploads/document/m3wzkd0n59/econTabReport.pdf
2020-02-16,2020-02-18,YouGov,Economist,529,a,D,Trump,FALSE,Do you approve or disapprove of Donald Trump’s handling of the coronavirus outbreak?,11,59,https://d25d2506sfb94s.cloudfront.net/cumulus_uploads/document/m3wzkd0n59/econTabReport.pdf
2020-02-16,2020-02-18,YouGov,Economist,583,a,I,Trump,FALSE,Do you approve or disapprove of Donald Trump’s handling of the coronavirus outbreak?,36,25,https://d25d2506sfb94s.cloudfront.net/cumulus_uploads/document/m3wzkd0n59/econTabReport.pdf
2020-02-23,2020-02-25,YouGov,Economist,1500,a,all,Trump,FALSE,Do you approve or disapprove of Donald Trump’s handling of the coronavirus outbreak?,39,31,https://d25d2506sfb94s.cloudfront.net/cumulus_uploads/document/zye3phsf7t/econTabReport.pdf
2020-02-23,2020-02-25,YouGov,Economist,386,a,R,Trump,FALSE,Do you approve or disapprove of Donald Trump’s handling of the coronavirus outbreak?,77,7,https://d25d2506sfb94s.cloudfront.net/cumulus_uploads/document/zye3phsf7t/econTabReport.pdf
2020-02-23,2020-02-25,YouGov,Economist,525,a,D,Trump,FALSE,Do you approve or disapprove of Donald Trump’s handling of the coronavirus outbreak?,14,56,https://d25d2506sfb94s.cloudfront.net/cumulus_uploads/document/zye3phsf7t/econTabReport.pdf
2020-02-23,2020-02-25,YouGov,Economist,588,a,I,Trump,FALSE,Do you approve or disapprove of Donald Trump’s handling of the coronavirus outbreak?,34,26,https://d25d2506sfb94s.cloudfront.net/cumulus_uploads/document/zye3phsf7t/econTabReport.pdf
2020-02-24,2020-02-26,Morning Consult,"",2200,a,all,Trump,FALSE,Do you approve or disapprove of the job each of the following is doing in handling the spread of coronavirus in the United States? President Donald Trump,54,27,https://morningconsult.com/wp-content/uploads/2020/02/200260_crosstabs_CORONAVIRUS_Adults_v2_JB.pdf
2020-02-24,2020-02-26,Morning Consult,"",737,a,R,Trump,FALSE,Do you approve or disapprove of the job each of the following is doing in handling the spread of coronavirus in the United States? President Donald Trump,84,7,https://morningconsult.com/wp-content/uploads/2020/02/200260_crosstabs_CORONAVIRUS_Adults_v2_JB.pdf
2020-02-24,2020-02-26,Morning Consult,"",786,a,D,Trump,FALSE,Do you approve or disapprove of the job each of the following is doing in handling the spread of coronavirus in the United States? President Donald Trump,29,49,https://morningconsult.com/wp-content/uploads/2020/02/200260_crosstabs_CORONAVIRUS_Adults_v2_JB.pdf
2020-02-24,2020-02-26,Morning Consult,"",677,a,I,Trump,FALSE,Do you approve or disapprove of the job each of the following is doing in handling the spread of coronavirus in the United States? President Donald Trump,49,24,https://morningconsult.com/wp-content/uploads/2020/02/200260_crosstabs_CORONAVIRUS_Adults_v2_JB.pdf
2020-02-26,2020-02-28,Harris Poll,Harvard,2592,rv,all,Trump,FALSE,Do you approve or disapprove of the job President Trump is doing on ...? Reacting to coronavirus,48,52,https://harvardharrispoll.com/wp-content/uploads/2020/03/HHP_February2020_RegisteredVoters_Crosstabs.pdf
2020-02-26,2020-02-28,Harris Poll,Harvard,848,rv,R,Trump,FALSE,Do you approve or disapprove of the job President Trump is doing on ...? Reacting to coronavirus,82,18,https://harvardharrispoll.com/wp-content/uploads/2020/03/HHP_February2020_RegisteredVoters_Crosstabs.pdf
2020-02-26,2020-02-28,Harris Poll,Harvard,925,rv,D,Trump,FALSE,Do you approve or disapprove of the job President Trump is doing on ...? Reacting to coronavirus,22,78,https://harvardharrispoll.com/wp-content/uploads/2020/03/HHP_February2020_RegisteredVoters_Crosstabs.pdf
2020-02-26,2020-02-28,Harris Poll,Harvard,735,rv,I,Trump,FALSE,Do you approve or disapprove of the job President Trump is doing on ...? Reacting to coronavirus,46,54,https://harvardharrispoll.com/wp-content/uploads/2020/03/HHP_February2020_RegisteredVoters_Crosstabs.pdf
2020-02-26,2020-02-28,YouGov,Huffington Post,1000,a,all,Trump,FALSE,Do you approve or disapprove of the way President Trump is handling issues related to the coronavirus?,45,38,https://projects.fivethirtyeight.com/polls/20200318_National_HPYouGov_coronavirus_2.pdf
2020-02-26,2020-02-28,YouGov,Huffington Post,278,a,R,Trump,FALSE,Do you approve or disapprove of the way President Trump is handling issues related to the coronavirus?,89,6,https://projects.fivethirtyeight.com/polls/20200318_National_HPYouGov_coronavirus_2.pdf
2020-02-26,2020-02-28,YouGov,Huffington Post,324,a,D,Trump,FALSE,Do you approve or disapprove of the way President Trump is handling issues related to the coronavirus?,18,70,https://projects.fivethirtyeight.com/polls/20200318_National_HPYouGov_coronavirus_2.pdf
2020-02-26,2020-02-28,YouGov,Huffington Post,387,a,I,Trump,FALSE,Do you approve or disapprove of the way President Trump is handling issues related to the coronavirus?,38,35,https://projects.fivethirtyeight.com/polls/20200318_National_HPYouGov_coronavirus_2.pdf
2020-02-28,2020-03-01,Morning Consult,"",2201,a,all,Trump,FALSE,Do you approve or disapprove of the job each of the following is doing in handling the spread of coronavirus in the United States? President Donald Trump,48,35,https://morningconsult.com/wp-content/uploads/2020/03/200271_crosstabs_CORONAVIRUS_Adults_v2_JB-1.pdf
2020-02-28,2020-03-01,Morning Consult,"",694,a,R,Trump,FALSE,Do you approve or disapprove of the job each of the following is doing in handling the spread of coronavirus in the United States? President Donald Trump,84,7,https://morningconsult.com/wp-content/uploads/2020/03/200271_crosstabs_CORONAVIRUS_Adults_v2_JB-1.pdf
2020-02-28,2020-03-01,Morning Consult,"",814,a,D,Trump,FALSE,Do you approve or disapprove of the job each of the following is doing in handling the spread of coronavirus in the United States? President Donald Trump,23,61,https://morningconsult.com/wp-content/uploads/2020/03/200271_crosstabs_CORONAVIRUS_Adults_v2_JB-1.pdf
2020-02-28,2020-03-01,Morning Consult,"",692,a,I,Trump,FALSE,Do you approve or disapprove of the job each of the following is doing in handling the spread of coronavirus in the United States? President Donald Trump,41,33,https://morningconsult.com/wp-content/uploads/2020/03/200271_crosstabs_CORONAVIRUS_Adults_v2_JB-1.pdf
2020-03-01,2020-03-03,YouGov,Economist,1500,a,all,Trump,FALSE,Do you approve or disapprove of Donald Trump’s handling of the coronavirus outbreak?,37,47,https://d25d2506sfb94s.cloudfront.net/cumulus_uploads/document/3rdraw493c/econTabReport.pdf
2020-03-01,2020-03-03,YouGov,Economist,250,a,R,Trump,FALSE,Do you approve or disapprove of Donald Trump’s handling of the coronavirus outbreak?,85,8,https://d25d2506sfb94s.cloudfront.net/cumulus_uploads/document/3rdraw493c/econTabReport.pdf
2020-03-01,2020-03-03,YouGov,Economist,622,a,D,Trump,FALSE,Do you approve or disapprove of Donald Trump’s handling of the coronavirus outbreak?,11,80,https://d25d2506sfb94s.cloudfront.net/cumulus_uploads/document/3rdraw493c/econTabReport.pdf
2020-03-01,2020-03-03,YouGov,Economist,618,a,I,Trump,FALSE,Do you approve or disapprove of Donald Trump’s handling of the coronavirus outbreak?,34,41,https://d25d2506sfb94s.cloudfront.net/cumulus_uploads/document/3rdraw493c/econTabReport.pdf
2020-03-02,2020-03-03,Ipsos (online),Reuters,1115,a,all,Trump,FALSE,Do you approve or disapprove of the way Donald Trump is handling the following issues? Coronavirus/COVID-19,38,47,https://www.ipsos.com/sites/default/files/ct/news/documents/2020-03/topline_reuters_coronavirus_03_03_2020.pdf
2020-03-02,2020-03-03,Ipsos (online),Reuters,396,a,R,Trump,FALSE,Do you approve or disapprove of the way Donald Trump is handling the following issues? Coronavirus/COVID-19,75,13,https://www.ipsos.com/sites/default/files/ct/news/documents/2020-03/topline_reuters_coronavirus_03_03_2020.pdf
2020-03-02,2020-03-03,Ipsos (online),Reuters,527,a,D,Trump,FALSE,Do you approve or disapprove of the way Donald Trump is handling the following issues? Coronavirus/COVID-19,15,76,https://www.ipsos.com/sites/default/files/ct/news/documents/2020-03/topline_reuters_coronavirus_03_03_2020.pdf
2020-03-02,2020-03-03,Ipsos (online),Reuters,102,a,I,Trump,FALSE,Do you approve or disapprove of the way Donald Trump is handling the following issues? Coronavirus/COVID-19,23,57,https://www.ipsos.com/sites/default/files/ct/news/documents/2020-03/topline_reuters_coronavirus_03_03_2020.pdf
2020-03-02,2020-03-08,SurveyMonkey,New York Times,2593,a,all,Trump,FALSE,Do you approve or disapprove of the way President Trump is handling the federal government’s response to the coronavirus?,47,48,https://www.surveymonkey.com/curiosity/nyt-march-2020-cci/
2020-03-02,2020-03-08,SurveyMonkey,New York Times,1128,a,R,Trump,FALSE,Do you approve or disapprove of the way President Trump is handling the federal government’s response to the coronavirus?,86,13,https://www.surveymonkey.com/curiosity/nyt-march-2020-cci/
2020-03-02,2020-03-08,SurveyMonkey,New York Times,1053,a,D,Trump,FALSE,Do you approve or disapprove of the way President Trump is handling the federal government’s response to the coronavirus?,16,82,https://www.surveymonkey.com/curiosity/nyt-march-2020-cci/
2020-03-02,2020-03-08,SurveyMonkey,New York Times,344,a,I,Trump,FALSE,Do you approve or disapprove of the way President Trump is handling the federal government’s response to the coronavirus?,38,58,https://www.surveymonkey.com/curiosity/nyt-march-2020-cci/
2020-03-03,2020-03-05,Morning Consult,"",1990,rv,all,Trump,FALSE,Do you approve or disapprove of the job each of the following is doing in handling the spread of coronavirus in the United States? President Donald Trump,44,42,https://morningconsult.com/wp-content/uploads/2020/03/200311_crosstabs_CORONAVIRUS_RVs_v3_YW.pdf
2020-03-03,2020-03-05,Morning Consult,"",675,rv,R,Trump,FALSE,Do you approve or disapprove of the job each of the following is doing in handling the spread of coronavirus in the United States? President Donald Trump,79,9,https://morningconsult.com/wp-content/uploads/2020/03/200311_crosstabs_CORONAVIRUS_RVs_v3_YW.pdf
2020-03-03,2020-03-05,Morning Consult,"",769,rv,D,Trump,FALSE,Do you approve or disapprove of the job each of the following is doing in handling the spread of coronavirus in the United States? President Donald Trump,15,72,https://morningconsult.com/wp-content/uploads/2020/03/200311_crosstabs_CORONAVIRUS_RVs_v3_YW.pdf
2020-03-03,2020-03-05,Morning Consult,"",545,rv,I,Trump,FALSE,Do you approve or disapprove of the job each of the following is doing in handling the spread of coronavirus in the United States? President Donald Trump,40,42,https://morningconsult.com/wp-content/uploads/2020/03/200311_crosstabs_CORONAVIRUS_RVs_v3_YW.pdf
2020-03-04,2020-03-07,SSRS,CNN,1211,a,all,Trump,FALSE,Do you approve or disapprove of the way Donald Trump is handling the coronavirus outbreak?,41,48,"https://cdn.cnn.com/cnn/2020/images/03/09/rel2b.-.trump,.coronavirus.pdf"
2020-03-04,2020-03-07,SSRS,CNN,351.19,a,R,Trump,FALSE,Do you approve or disapprove of the way Donald Trump is handling the coronavirus outbreak?,79,11,"https://cdn.cnn.com/cnn/2020/images/03/09/rel2b.-.trump,.coronavirus.pdf"
2020-03-04,2020-03-07,SSRS,CNN,411.74,a,D,Trump,FALSE,Do you approve or disapprove of the way Donald Trump is handling the coronavirus outbreak?,10,84,"https://cdn.cnn.com/cnn/2020/images/03/09/rel2b.-.trump,.coronavirus.pdf"
2020-03-04,2020-03-07,SSRS,CNN,448.07,a,I,Trump,FALSE,Do you approve or disapprove of the way Donald Trump is handling the coronavirus outbreak?,37,47,"https://cdn.cnn.com/cnn/2020/images/03/09/rel2b.-.trump,.coronavirus.pdf"
2020-03-05,2020-03-08,Quinnipiac,"",1261,rv,all,Trump,FALSE,Do you approve or disapprove of the way Donald Trump is handling the response to the coronavirus?,43,49,https://poll.qu.edu/national/release-detail?ReleaseID=3657
2020-03-05,2020-03-08,Quinnipiac,"",378.3,rv,R,Trump,FALSE,Do you approve or disapprove of the way Donald Trump is handling the response to the coronavirus?,87,7,https://poll.qu.edu/national/release-detail?ReleaseID=3657
2020-03-05,2020-03-08,Quinnipiac,"",453.96,rv,D,Trump,FALSE,Do you approve or disapprove of the way Donald Trump is handling the response to the coronavirus?,10,83,https://poll.qu.edu/national/release-detail?ReleaseID=3657
2020-03-05,2020-03-08,Quinnipiac,"",315.25,rv,I,Trump,FALSE,Do you approve or disapprove of the way Donald Trump is handling the response to the coronavirus?,37,50,https://poll.qu.edu/national/release-detail?ReleaseID=3657
2020-03-06,2020-03-08,Global Strategy Group/GBAO/Navigator Research,"",1000,rv,all,Trump,FALSE,Do you approve or disapprove of the way that Donald Trump is handling the coronavirus outbreak?,42,49,https://navigatorresearch.org/wp-content/uploads/2020/03/March-2020-Navigator-Coronavirus-Toplines.pdf
2020-03-06,2020-03-08,Global Strategy Group/GBAO/Navigator Research,"",340,rv,R,Trump,FALSE,Do you approve or disapprove of the way that Donald Trump is handling the coronavirus outbreak?,79,13,https://navigatorresearch.org/wp-content/uploads/2020/03/March-2020-Navigator-Coronavirus-Toplines.pdf
2020-03-06,2020-03-08,Global Strategy Group/GBAO/Navigator Research,"",420,rv,D,Trump,FALSE,Do you approve or disapprove of the way that Donald Trump is handling the coronavirus outbreak?,12,80,https://navigatorresearch.org/wp-content/uploads/2020/03/March-2020-Navigator-Coronavirus-Toplines.pdf
2020-03-06,2020-03-08,Global Strategy Group/GBAO/Navigator Research,"",240,rv,I,Trump,FALSE,Do you approve or disapprove of the way that Donald Trump is handling the coronavirus outbreak?,35,46,https://navigatorresearch.org/wp-content/uploads/2020/03/March-2020-Navigator-Coronavirus-Toplines.pdf
2020-03-06,2020-03-09,Morning Consult,"",2200,a,all,Trump,FALSE,Do you approve or disapprove of the job each of the following is doing in handling the spread of coronavirus in the United States? President Donald Trump,42,43,https://morningconsult.com/wp-content/uploads/2020/03/200326_crosstabs_CORONAVIRUS_Adults_v4_JB.pdf
2020-03-06,2020-03-09,Morning Consult,"",658,a,R,Trump,FALSE,Do you approve or disapprove of the job each of the following is doing in handling the spread of coronavirus in the United States? President Donald Trump,81,10,https://morningconsult.com/wp-content/uploads/2020/03/200326_crosstabs_CORONAVIRUS_Adults_v4_JB.pdf
2020-03-06,2020-03-09,Morning Consult,"",809,a,D,Trump,FALSE,Do you approve or disapprove of the job each of the following is doing in handling the spread of coronavirus in the United States? President Donald Trump,16,72,https://morningconsult.com/wp-content/uploads/2020/03/200326_crosstabs_CORONAVIRUS_Adults_v4_JB.pdf
2020-03-06,2020-03-09,Morning Consult,"",733,a,I,Trump,FALSE,Do you approve or disapprove of the job each of the following is doing in handling the spread of coronavirus in the United States? President Donald Trump,36,41,https://morningconsult.com/wp-content/uploads/2020/03/200326_crosstabs_CORONAVIRUS_Adults_v4_JB.pdf
2020-03-08,2020-03-09,HarrisX,Hill.TV,1001,rv,all,Trump,FALSE,Do you approve or disapprove of the job President Trump is doing on handling the coronavirus outbreak?,47,53,https://thehill.com/hilltv/what-americas-thinking/487327-poll-trump-sees-high-marks-on-the-economy-low-marks-on-handling
2020-03-08,2020-03-09,HarrisX,Hill.TV,320,rv,R,Trump,FALSE,Do you approve or disapprove of the job President Trump is doing on handling the coronavirus outbreak?,82,18,https://thehill.com/hilltv/what-americas-thinking/487327-poll-trump-sees-high-marks-on-the-economy-low-marks-on-handling
2020-03-08,2020-03-09,HarrisX,Hill.TV,370,rv,D,Trump,FALSE,Do you approve or disapprove of the job President Trump is doing on handling the coronavirus outbreak?,21,79,https://thehill.com/hilltv/what-americas-thinking/487327-poll-trump-sees-high-marks-on-the-economy-low-marks-on-handling
2020-03-08,2020-03-09,HarrisX,Hill.TV,290,rv,I,Trump,FALSE,Do you approve or disapprove of the job President Trump is doing on handling the coronavirus outbreak?,42,58,https://thehill.com/hilltv/what-americas-thinking/487327-poll-trump-sees-high-marks-on-the-economy-low-marks-on-handling
2020-03-08,2020-03-10,YouGov,Economist,1500,a,all,Trump,FALSE,Do you approve or disapprove of Donald Trump’s handling of the coronavirus outbreak?,42,43,https://docs.cdn.yougov.com/vrbl9mmctz/econTabReport.pdf
2020-03-08,2020-03-10,YouGov,Economist,374,a,R,Trump,FALSE,Do you approve or disapprove of Donald Trump’s handling of the coronavirus outbreak?,82,8,https://docs.cdn.yougov.com/vrbl9mmctz/econTabReport.pdf
2020-03-08,2020-03-10,YouGov,Economist,533,a,D,Trump,FALSE,Do you approve or disapprove of Donald Trump’s handling of the coronavirus outbreak?,12,78,https://docs.cdn.yougov.com/vrbl9mmctz/econTabReport.pdf
2020-03-08,2020-03-10,YouGov,Economist,586,a,I,Trump,FALSE,Do you approve or disapprove of Donald Trump’s handling of the coronavirus outbreak?,42,37,https://docs.cdn.yougov.com/vrbl9mmctz/econTabReport.pdf
2020-03-09,2020-03-10,Ipsos (online),Reuters,1113,a,all,Trump,FALSE,Do you approve or disapprove of the way Donald Trump is handling the following issues? Coronavirus/COVID-19,39,49,https://www.ipsos.com/en-us/news-polls/reuters-ipsos-data-core-political-2020-03-11
2020-03-09,2020-03-11,Change Research,CNBC,1541,lv,all,Trump,FALSE,How would you rate the response of each of the following people and groups to the coronavirus? - President Trump,42,58,https://www.cnbc.com/2020/03/15/americans-worry-coronavirus-will-cause-recession-cnbcchange-research-poll.html
2020-03-10,2020-03-11,YouGov,Yahoo News,1635,a,all,Trump,FALSE,Do you approve or disapprove of the way President Trump has handled coronavirus?,41,46,https://docs.cdn.yougov.com/ap1p15w9nv/20200311_yahoo_coronavirus_crosstabs.pdf
2020-03-10,2020-03-11,YouGov,Yahoo News,406,a,R,Trump,FALSE,Do you approve or disapprove of the way President Trump has handled coronavirus?,84,10,https://docs.cdn.yougov.com/ap1p15w9nv/20200311_yahoo_coronavirus_crosstabs.pdf
2020-03-10,2020-03-11,YouGov,Yahoo News,568,a,D,Trump,FALSE,Do you approve or disapprove of the way President Trump has handled coronavirus?,18,74,https://docs.cdn.yougov.com/ap1p15w9nv/20200311_yahoo_coronavirus_crosstabs.pdf
2020-03-10,2020-03-11,YouGov,Yahoo News,659,a,I,Trump,FALSE,Do you approve or disapprove of the way President Trump has handled coronavirus?,35,44,https://docs.cdn.yougov.com/ap1p15w9nv/20200311_yahoo_coronavirus_crosstabs.pdf
2020-03-10,2020-03-12,YouGov,Huffington Post,1000,a,all,Trump,FALSE,Do you approve or disapprove of the way President Trump is handling issues related to the coronavirus?,44,43,https://big.assets.huffingtonpost.com/athena/files/2020/03/17/5e70fe10c5b63c3b6485b422.pdf
2020-03-10,2020-03-12,YouGov,Huffington Post,241,a,R,Trump,FALSE,Do you approve or disapprove of the way President Trump is handling issues related to the coronavirus?,88,8,https://big.assets.huffingtonpost.com/athena/files/2020/03/17/5e70fe10c5b63c3b6485b422.pdf
2020-03-10,2020-03-12,YouGov,Huffington Post,328,a,D,Trump,FALSE,Do you approve or disapprove of the way President Trump is handling issues related to the coronavirus?,16,78,https://big.assets.huffingtonpost.com/athena/files/2020/03/17/5e70fe10c5b63c3b6485b422.pdf
2020-03-10,2020-03-12,YouGov,Huffington Post,422,a,I,Trump,FALSE,Do you approve or disapprove of the way President Trump is handling issues related to the coronavirus?,39,37,https://big.assets.huffingtonpost.com/athena/files/2020/03/17/5e70fe10c5b63c3b6485b422.pdf
2020-03-10,2020-03-14,Morning Consult,"",2200,a,all,Trump,FALSE,Do you approve or disapprove of the job each of the following is doing in handling the spread of coronavirus in the United States? President Donald Trump,43,42,https://morningconsult.com/wp-content/uploads/2020/03/200333_crosstabs_CORONAVIRUS_Adults_v3_JB-2.pdf
2020-03-10,2020-03-14,Morning Consult,"",693,a,R,Trump,FALSE,Do you approve or disapprove of the job each of the following is doing in handling the spread of coronavirus in the United States? President Donald Trump,83,11,https://morningconsult.com/wp-content/uploads/2020/03/200333_crosstabs_CORONAVIRUS_Adults_v3_JB-2.pdf
2020-03-10,2020-03-14,Morning Consult,"",754,a,D,Trump,FALSE,Do you approve or disapprove of the job each of the following is doing in handling the spread of coronavirus in the United States? President Donald Trump,16,74,https://morningconsult.com/wp-content/uploads/2020/03/200333_crosstabs_CORONAVIRUS_Adults_v3_JB-2.pdf
2020-03-10,2020-03-14,Morning Consult,"",753,a,I,Trump,FALSE,Do you approve or disapprove of the job each of the following is doing in handling the spread of coronavirus in the United States? President Donald Trump,34,41,https://morningconsult.com/wp-content/uploads/2020/03/200333_crosstabs_CORONAVIRUS_Adults_v3_JB-2.pdf
2020-03-11,2020-03-12,Ipsos (online),ABC News,502,a,all,Trump,FALSE,Do you approve or disapprove of the way Donald Trump is handling the response to the coronavirus (COVID-19)?,43,54,https://www.ipsos.com/sites/default/files/ct/news/documents/2020-03/topline-abc-news-coronavirus-031320.pdf
2020-03-11,2020-03-12,Ipsos (online),ABC News,128,a,R,Trump,FALSE,Do you approve or disapprove of the way Donald Trump is handling the response to the coronavirus (COVID-19)?,86,11,https://www.ipsos.com/sites/default/files/ct/news/documents/2020-03/topline-abc-news-coronavirus-031320.pdf
2020-03-11,2020-03-12,Ipsos (online),ABC News,149,a,D,Trump,FALSE,Do you approve or disapprove of the way Donald Trump is handling the response to the coronavirus (COVID-19)?,14,86,https://www.ipsos.com/sites/default/files/ct/news/documents/2020-03/topline-abc-news-coronavirus-031320.pdf
2020-03-11,2020-03-12,Ipsos (online),ABC News,201,a,I,Trump,FALSE,Do you approve or disapprove of the way Donald Trump is handling the response to the coronavirus (COVID-19)?,38,61,https://www.ipsos.com/sites/default/files/ct/news/documents/2020-03/topline-abc-news-coronavirus-031320.pdf
2020-03-11,2020-03-13,NBC/Wall Street Journal,"",900,rv,all,Trump,FALSE,"In general, do you approve or disapprove of the way Donald Trump is handling the coronavirus?",45,51,https://www.documentcloud.org/documents/6810602-200149-NBCWSJ-March-Poll-Final-3-14-20-Release.html
2020-03-11,2020-03-13,NBC/Wall Street Journal,"",323,rv,R,Trump,FALSE,"In general, do you approve or disapprove of the way Donald Trump is handling the coronavirus?",81,14,https://www.documentcloud.org/documents/6810602-200149-NBCWSJ-March-Poll-Final-3-14-20-Release.html
2020-03-11,2020-03-13,NBC/Wall Street Journal,"",395,rv,D,Trump,FALSE,"In general, do you approve or disapprove of the way Donald Trump is handling the coronavirus?",13,84,https://www.documentcloud.org/documents/6810602-200149-NBCWSJ-March-Poll-Final-3-14-20-Release.html
2020-03-11,2020-03-13,NBC/Wall Street Journal,"",108,rv,I,Trump,FALSE,"In general, do you approve or disapprove of the way Donald Trump is handling the coronavirus?",43,52,https://www.documentcloud.org/documents/6810602-200149-NBCWSJ-March-Poll-Final-3-14-20-Release.html
2020-03-11,2020-03-13,Winston,"",1000,rv,all,Trump,FALSE,Overall would you say that you approve or disapprove of the job Donald Trump is doing in handling the current health situation involving the coronavirus?,42,45,https://www.winningtheissues.org/wp-content/uploads/2020/08/Winning-the-Issues-March-2020-National-Survey.pdf
2020-03-12,2020-03-12,SurveyUSA,"",850,a,all,Trump,FALSE,"Do you approve or disapprove of way President Donald Trump is handling COVID-19, the Coronavirus?",46,46,http://www.surveyusa.com/client/PollTrack.aspx?g=41b2a625-ff4d-4ffa-99b2-de9cc09cdd58
2020-03-12,2020-03-12,SurveyUSA,"",256,a,R,Trump,FALSE,"Do you approve or disapprove of way President Donald Trump is handling COVID-19, the Coronavirus?",80,15,http://www.surveyusa.com/client/PollTrack.aspx?g=41b2a625-ff4d-4ffa-99b2-de9cc09cdd58
2020-03-12,2020-03-12,SurveyUSA,"",337,a,D,Trump,FALSE,"Do you approve or disapprove of way President Donald Trump is handling COVID-19, the Coronavirus?",10,72,http://www.surveyusa.com/client/PollTrack.aspx?g=41b2a625-ff4d-4ffa-99b2-de9cc09cdd58
2020-03-12,2020-03-12,SurveyUSA,"",207,a,I,Trump,FALSE,"Do you approve or disapprove of way President Donald Trump is handling COVID-19, the Coronavirus?",46,42,http://www.surveyusa.com/client/PollTrack.aspx?g=41b2a625-ff4d-4ffa-99b2-de9cc09cdd58
2020-03-13,2020-03-14,Marist,"NPR,PBS NewsHour",835,a,all,Trump,FALSE,Do you approve or disapprove of how President Donald Trump is handling the coronavirus pandemic?,44,49,http://maristpoll.marist.edu/wp-content/uploads/2020/03/NPR_PBS-NewsHour_Marist-Poll_USA-NOS-and-Tables_2003151338.pdf
2020-03-13,2020-03-14,Marist,"NPR,PBS NewsHour",784,rv,all,Trump,FALSE,Do you approve or disapprove of how President Donald Trump is handling the coronavirus pandemic?,45,49,http://maristpoll.marist.edu/wp-content/uploads/2020/03/NPR_PBS-NewsHour_Marist-Poll_USA-NOS-and-Tables_2003151338.pdf
2020-03-13,2020-03-14,Marist,"NPR,PBS NewsHour",243.04,rv,R,Trump,FALSE,Do you approve or disapprove of how President Donald Trump is handling the coronavirus pandemic?,85,11,http://maristpoll.marist.edu/wp-content/uploads/2020/03/NPR_PBS-NewsHour_Marist-Poll_USA-NOS-and-Tables_2003151338.pdf
2020-03-13,2020-03-14,Marist,"NPR,PBS NewsHour",290.08,rv,D,Trump,FALSE,Do you approve or disapprove of how President Donald Trump is handling the coronavirus pandemic?,15,83,http://maristpoll.marist.edu/wp-content/uploads/2020/03/NPR_PBS-NewsHour_Marist-Poll_USA-NOS-and-Tables_2003151338.pdf
2020-03-13,2020-03-14,Marist,"NPR,PBS NewsHour",235.2,rv,I,Trump,FALSE,Do you approve or disapprove of how President Donald Trump is handling the coronavirus pandemic?,40,50,http://maristpoll.marist.edu/wp-content/uploads/2020/03/NPR_PBS-NewsHour_Marist-Poll_USA-NOS-and-Tables_2003151338.pdf
2020-03-13,2020-03-15,Hart Research Associates,Protect Our Care,1015,rv,all,Trump,FALSE,Do you approve or disapprove of the job Donald Trump is doing in dealing with the coronavirus?,50,50,https://www.protectourcare.org/wp-content/uploads/2020/03/FI12859-Coronavirus-March-2020.pdf
2020-03-13,2020-03-15,YouGov,Huffington Post,1000,a,all,Trump,FALSE,Do you approve or disapprove of the way President Trump is handling issues related to the coronavirus?,44,43,https://big.assets.huffingtonpost.com/athena/files/2020/03/17/5e70fe10c5b60fb69ddf0b8d.pdf
2020-03-13,2020-03-15,YouGov,Huffington Post,233,a,R,Trump,FALSE,Do you approve or disapprove of the way President Trump is handling issues related to the coronavirus?,89,6,https://big.assets.huffingtonpost.com/athena/files/2020/03/17/5e70fe10c5b60fb69ddf0b8d.pdf
2020-03-13,2020-03-15,YouGov,Huffington Post,352,a,D,Trump,FALSE,Do you approve or disapprove of the way President Trump is handling issues related to the coronavirus?,20,75,https://big.assets.huffingtonpost.com/athena/files/2020/03/17/5e70fe10c5b60fb69ddf0b8d.pdf
2020-03-13,2020-03-15,YouGov,Huffington Post,415,a,I,Trump,FALSE,Do you approve or disapprove of the way President Trump is handling issues related to the coronavirus?,40,37,https://big.assets.huffingtonpost.com/athena/files/2020/03/17/5e70fe10c5b60fb69ddf0b8d.pdf
2020-03-13,2020-03-16,Morning Consult,Politico,1986,rv,all,Trump,FALSE,How would you rate each of the following on their handling of the coronavirus? President Donald Trump,41,51,https://morningconsult.com/wp-content/uploads/2020/03/200346_crosstabs_POLITICO_RVs_v1_AUTO.pdf
2020-03-13,2020-03-16,Morning Consult,Politico,677,rv,R,Trump,FALSE,How would you rate each of the following on their handling of the coronavirus? President Donald Trump,79,14,https://morningconsult.com/wp-content/uploads/2020/03/200346_crosstabs_POLITICO_RVs_v1_AUTO.pdf
2020-03-13,2020-03-16,Morning Consult,Politico,761,rv,D,Trump,FALSE,How would you rate each of the following on their handling of the coronavirus? President Donald Trump,10,84,https://morningconsult.com/wp-content/uploads/2020/03/200346_crosstabs_POLITICO_RVs_v1_AUTO.pdf
2020-03-13,2020-03-16,Morning Consult,Politico,547,rv,I,Trump,FALSE,How would you rate each of the following on their handling of the coronavirus? President Donald Trump,35,52,https://morningconsult.com/wp-content/uploads/2020/03/200346_crosstabs_POLITICO_RVs_v1_AUTO.pdf
2020-03-13,2020-03-16,Morning Consult,"",1986,rv,all,Trump,FALSE,Do you approve or disapprove of the job each of the following is doing in handling the spread of coronavirus in the United States? President Donald Trump,47,43,https://morningconsult.com/wp-content/uploads/2020/03/200346_crosstabs_CORONAVIRUS_TREND_RVs_v3_JB-1.pdf
2020-03-13,2020-03-16,Morning Consult,"",677,rv,R,Trump,FALSE,Do you approve or disapprove of the job each of the following is doing in handling the spread of coronavirus in the United States? President Donald Trump,83,10,https://morningconsult.com/wp-content/uploads/2020/03/200346_crosstabs_CORONAVIRUS_TREND_RVs_v3_JB-1.pdf
2020-03-13,2020-03-16,Morning Consult,"",761,rv,D,Trump,FALSE,Do you approve or disapprove of the job each of the following is doing in handling the spread of coronavirus in the United States? President Donald Trump,18,73,https://morningconsult.com/wp-content/uploads/2020/03/200346_crosstabs_CORONAVIRUS_TREND_RVs_v3_JB-1.pdf
2020-03-13,2020-03-16,Morning Consult,"",547,rv,I,Trump,FALSE,Do you approve or disapprove of the job each of the following is doing in handling the spread of coronavirus in the United States? President Donald Trump,43,43,https://morningconsult.com/wp-content/uploads/2020/03/200346_crosstabs_CORONAVIRUS_TREND_RVs_v3_JB-1.pdf
2020-03-13,2020-03-22,Gallup,"",1020,a,all,Trump,FALSE,Do you approve or disapprove of the way each of the following is handling the response to the coronavirus in the U.S.? President Donald Trump,60,38,https://news.gallup.com/poll/298313/president-trump-job-approval-rating.aspx
2020-03-13,2020-03-22,Gallup,"",318,a,R,Trump,FALSE,Do you approve or disapprove of the way each of the following is handling the response to the coronavirus in the U.S.? President Donald Trump,94,6,https://news.gallup.com/poll/298313/president-trump-job-approval-rating.aspx
2020-03-13,2020-03-22,Gallup,"",314,a,D,Trump,FALSE,Do you approve or disapprove of the way each of the following is handling the response to the coronavirus in the U.S.? President Donald Trump,27,72,https://news.gallup.com/poll/298313/president-trump-job-approval-rating.aspx
2020-03-13,2020-03-22,Gallup,"",338,a,I,Trump,FALSE,Do you approve or disapprove of the way each of the following is handling the response to the coronavirus in the U.S.? President Donald Trump,60,39,https://news.gallup.com/poll/298313/president-trump-job-approval-rating.aspx
2020-03-14,2020-03-15,Harris Poll,"",2050,a,all,Trump,FALSE,How much do you approve or disapprove of the job President Trump is doing on each of the following? Handling coronavirus (COVID-19),51,49,https://theharrispoll.com/wp-content/uploads/2020/03/Harris-Poll-COVID19-Tabs_Wave-2.pdf
2020-03-14,2020-03-15,Harris Poll,"",659,a,R,Trump,FALSE,How much do you approve or disapprove of the job President Trump is doing on each of the following? Handling coronavirus (COVID-19),85,15,https://theharrispoll.com/wp-content/uploads/2020/03/Harris-Poll-COVID19-Tabs_Wave-2.pdf
2020-03-14,2020-03-15,Harris Poll,"",779,a,D,Trump,FALSE,How much do you approve or disapprove of the job President Trump is doing on each of the following? Handling coronavirus (COVID-19),26,74,https://theharrispoll.com/wp-content/uploads/2020/03/Harris-Poll-COVID19-Tabs_Wave-2.pdf
2020-03-14,2020-03-15,Harris Poll,"",509,a,I,Trump,FALSE,How much do you approve or disapprove of the job President Trump is doing on each of the following? Handling coronavirus (COVID-19),53,47,https://theharrispoll.com/wp-content/uploads/2020/03/Harris-Poll-COVID19-Tabs_Wave-2.pdf
2020-03-15,2020-03-17,YouGov,Economist,1500,a,all,Trump,FALSE,Do you approve or disapprove of Donald Trump’s handling of the coronavirus outbreak?,45,46,https://docs.cdn.yougov.com/fcdckgt368/econTabReport.pdf
2020-03-15,2020-03-17,YouGov,Economist,382,a,R,Trump,FALSE,Do you approve or disapprove of Donald Trump’s handling of the coronavirus outbreak?,82,13,https://docs.cdn.yougov.com/fcdckgt368/econTabReport.pdf
2020-03-15,2020-03-17,YouGov,Economist,511,a,D,Trump,FALSE,Do you approve or disapprove of Donald Trump’s handling of the coronavirus outbreak?,22,73,https://docs.cdn.yougov.com/fcdckgt368/econTabReport.pdf
2020-03-15,2020-03-17,YouGov,Economist,593,a,I,Trump,FALSE,Do you approve or disapprove of Donald Trump’s handling of the coronavirus outbreak?,41,45,https://docs.cdn.yougov.com/fcdckgt368/econTabReport.pdf
2020-03-16,2020-03-17,Ipsos (online),Reuters,1115,a,all,Trump,FALSE,Do you approve or disapprove of the way Donald Trump is handling the following issues? Coronavirus/COVID-19,47,47,https://fingfx.thomsonreuters.com/gfx/mkt/13/3563/3524/Topline%20Reuters%20Coronavirus%2003%2017%202020.pdf
2020-03-16,2020-03-17,Ipsos (online),Reuters,387,a,R,Trump,FALSE,Do you approve or disapprove of the way Donald Trump is handling the following issues? Coronavirus/COVID-19,82,15,https://fingfx.thomsonreuters.com/gfx/mkt/13/3563/3524/Topline%20Reuters%20Coronavirus%2003%2017%202020.pdf
2020-03-16,2020-03-17,Ipsos (online),Reuters,539,a,D,Trump,FALSE,Do you approve or disapprove of the way Donald Trump is handling the following issues? Coronavirus/COVID-19,21,75,https://fingfx.thomsonreuters.com/gfx/mkt/13/3563/3524/Topline%20Reuters%20Coronavirus%2003%2017%202020.pdf
2020-03-16,2020-03-17,Ipsos (online),Reuters,115,a,I,Trump,FALSE,Do you approve or disapprove of the way Donald Trump is handling the following issues? Coronavirus/COVID-19,46,46,https://fingfx.thomsonreuters.com/gfx/mkt/13/3563/3524/Topline%20Reuters%20Coronavirus%2003%2017%202020.pdf
2020-03-16,2020-03-19,American Research Group,"",1100,a,all,Trump,FALSE,Do you approve or disapprove of the way Donald Trump is handling the coronavirus outbreak?,41,55,https://americanresearchgroup.com/economy/
2020-03-16,2020-03-19,American Research Group,"",995,rv,all,Trump,FALSE,Do you approve or disapprove of the way Donald Trump is handling the coronavirus outbreak?,41,55,https://americanresearchgroup.com/economy/
2020-03-16,2020-03-19,American Research Group,"",246,rv,R,Trump,FALSE,Do you approve or disapprove of the way Donald Trump is handling the coronavirus outbreak?,95,2,https://americanresearchgroup.com/economy/
2020-03-16,2020-03-19,American Research Group,"",358,rv,D,Trump,FALSE,Do you approve or disapprove of the way Donald Trump is handling the coronavirus outbreak?,7,89,https://americanresearchgroup.com/economy/
2020-03-16,2020-03-19,American Research Group,"",391,rv,I,Trump,FALSE,Do you approve or disapprove of the way Donald Trump is handling the coronavirus outbreak?,38,57,https://americanresearchgroup.com/economy/
2020-03-17,2020-03-18,Harris Poll,"",2019,a,all,Trump,FALSE,How much do you approve or disapprove of the job President Trump is doing on each of the following? Handling coronavirus (COVID-19),56,44,https://theharrispoll.com/wp-content/uploads/2020/04/Wave-2-3_tabs_updated-1.pdf
2020-03-17,2020-03-18,Harris Poll,"",662,a,R,Trump,FALSE,How much do you approve or disapprove of the job President Trump is doing on each of the following? Handling coronavirus (COVID-19),86,14,https://theharrispoll.com/wp-content/uploads/2020/04/Wave-2-3_tabs_updated-1.pdf
2020-03-17,2020-03-18,Harris Poll,"",744,a,D,Trump,FALSE,How much do you approve or disapprove of the job President Trump is doing on each of the following? Handling coronavirus (COVID-19),28,72,https://theharrispoll.com/wp-content/uploads/2020/04/Wave-2-3_tabs_updated-1.pdf
2020-03-17,2020-03-18,Harris Poll,"",613,a,I,Trump,FALSE,How much do you approve or disapprove of the job President Trump is doing on each of the following? Handling coronavirus (COVID-19),56,44,https://theharrispoll.com/wp-content/uploads/2020/04/Wave-2-3_tabs_updated-1.pdf
2020-03-17,2020-03-20,Morning Consult,"",1851,rv,all,Trump,FALSE,Do you approve or disapprove of the job each of the following is doing in handling the spread of coronavirus in the United States? President Donald Trump,53,39,https://morningconsult.com/wp-content/uploads/2020/03/200371_crosstabs_CORONAVIRUS_TREND_PARTIALS_RVs_v2_JB.pdf
2020-03-17,2020-03-20,Morning Consult,"",614,rv,R,Trump,FALSE,Do you approve or disapprove of the job each of the following is doing in handling the spread of coronavirus in the United States? President Donald Trump,87,9,https://morningconsult.com/wp-content/uploads/2020/03/200371_crosstabs_CORONAVIRUS_TREND_PARTIALS_RVs_v2_JB.pdf
2020-03-17,2020-03-20,Morning Consult,"",725,rv,D,Trump,FALSE,Do you approve or disapprove of the job each of the following is doing in handling the spread of coronavirus in the United States? President Donald Trump,26,64,https://morningconsult.com/wp-content/uploads/2020/03/200371_crosstabs_CORONAVIRUS_TREND_PARTIALS_RVs_v2_JB.pdf
2020-03-17,2020-03-20,Morning Consult,"",512,rv,I,Trump,FALSE,Do you approve or disapprove of the job each of the following is doing in handling the spread of coronavirus in the United States? President Donald Trump,51,38,https://morningconsult.com/wp-content/uploads/2020/03/200371_crosstabs_CORONAVIRUS_TREND_PARTIALS_RVs_v2_JB.pdf
2020-03-18,2020-03-19,Emerson College Polling Society,Nexstar,1100,rv,all,Trump,FALSE,Do you approve or disapprove of the way Trump is handling the federal government’s response to the outbreak of the Coronavirus?,49.1,41.4,https://emersonpolling.reportablenews.com/pr/march-national-poll-70-of-americans-worried-about-catching-coronavirus
2020-03-18,2020-03-19,Emerson College Polling Society,Nexstar,375,rv,R,Trump,FALSE,Do you approve or disapprove of the way Trump is handling the federal government’s response to the outbreak of the Coronavirus?,83.5,9.2,https://emersonpolling.reportablenews.com/pr/march-national-poll-70-of-americans-worried-about-catching-coronavirus
2020-03-18,2020-03-19,Emerson College Polling Society,Nexstar,402,rv,D,Trump,FALSE,Do you approve or disapprove of the way Trump is handling the federal government’s response to the outbreak of the Coronavirus?,20.8,68,https://emersonpolling.reportablenews.com/pr/march-national-poll-70-of-americans-worried-about-catching-coronavirus
2020-03-18,2020-03-19,Emerson College Polling Society,Nexstar,323,rv,I,Trump,FALSE,Do you approve or disapprove of the way Trump is handling the federal government’s response to the outbreak of the Coronavirus?,44.3,45.8,https://emersonpolling.reportablenews.com/pr/march-national-poll-70-of-americans-worried-about-catching-coronavirus
2020-03-18,2020-03-19,Ipsos (online),ABC News,512,a,all,Trump,FALSE,Do you approve or disapprove of the way Donald Trump is handling the response to the coronavirus (COVID-19)?,55,43,https://www.ipsos.com/sites/default/files/ct/news/documents/2020-03/topline-abc-news-coronavirus-032020.pdf
2020-03-18,2020-03-19,Ipsos (online),ABC News,152,a,R,Trump,FALSE,Do you approve or disapprove of the way Donald Trump is handling the response to the coronavirus (COVID-19)?,92,8,https://www.ipsos.com/sites/default/files/ct/news/documents/2020-03/topline-abc-news-coronavirus-032020.pdf
2020-03-18,2020-03-19,Ipsos (online),ABC News,140,a,D,Trump,FALSE,Do you approve or disapprove of the way Donald Trump is handling the response to the coronavirus (COVID-19)?,30,69,https://www.ipsos.com/sites/default/files/ct/news/documents/2020-03/topline-abc-news-coronavirus-032020.pdf
2020-03-18,2020-03-19,Ipsos (online),ABC News,201,a,I,Trump,FALSE,Do you approve or disapprove of the way Donald Trump is handling the response to the coronavirus (COVID-19)?,53,45,https://www.ipsos.com/sites/default/files/ct/news/documents/2020-03/topline-abc-news-coronavirus-032020.pdf
2020-03-18,2020-03-19,SurveyUSA,"",1000,a,all,Trump,FALSE,"Do you approve or disapprove of way President Donald Trump is handling COVID-19, the Coronavirus?",51,40,http://www.surveyusa.com/client/PollReport.aspx?g=982bb407-60fd-42bc-ac07-080c7af879b2
2020-03-18,2020-03-19,SurveyUSA,"",307,a,R,Trump,FALSE,"Do you approve or disapprove of way President Donald Trump is handling COVID-19, the Coronavirus?",90,6,http://www.surveyusa.com/client/PollReport.aspx?g=982bb407-60fd-42bc-ac07-080c7af879b2
2020-03-18,2020-03-19,SurveyUSA,"",414,a,D,Trump,FALSE,"Do you approve or disapprove of way President Donald Trump is handling COVID-19, the Coronavirus?",24,68,http://www.surveyusa.com/client/PollReport.aspx?g=982bb407-60fd-42bc-ac07-080c7af879b2
2020-03-18,2020-03-19,SurveyUSA,"",244,a,I,Trump,FALSE,"Do you approve or disapprove of way President Donald Trump is handling COVID-19, the Coronavirus?",48,38,http://www.surveyusa.com/client/PollReport.aspx?g=982bb407-60fd-42bc-ac07-080c7af879b2
2020-03-18,2020-03-22,Monmouth U.,"",851,a,all,Trump,FALSE,Has the following done a good job or bad job dealing with the coronavirus outbreak: President Trump?,50,45,https://www.monmouth.edu/polling-institute/documents/monmouthpoll_us_032320.pdf/
2020-03-18,2020-03-22,Monmouth U.,"",244,a,R,Trump,FALSE,Has the following done a good job or bad job dealing with the coronavirus outbreak: President Trump?,89,7,https://www.monmouth.edu/polling-institute/documents/monmouthpoll_us_032320.pdf/
2020-03-18,2020-03-22,Monmouth U.,"",282,a,D,Trump,FALSE,Has the following done a good job or bad job dealing with the coronavirus outbreak: President Trump?,19,76,https://www.monmouth.edu/polling-institute/documents/monmouthpoll_us_032320.pdf/
2020-03-18,2020-03-22,Monmouth U.,"",309,a,I,Trump,FALSE,Has the following done a good job or bad job dealing with the coronavirus outbreak: President Trump?,48,48,https://www.monmouth.edu/polling-institute/documents/monmouthpoll_us_032320.pdf/
2020-03-18,2020-03-24,Ipsos (online),Reuters,4428,a,all,Trump,FALSE,Do you approve or disapprove of the way Donald Trump is handling the following issues? Coronavirus/COVID-19,49,44,https://fingfx.thomsonreuters.com/gfx/mkt/13/3885/3841/Topline%20Reuters%20Coronavirus%2003%2024%202020.pdf
2020-03-18,2020-03-24,Ipsos (online),Reuters,1680,a,R,Trump,FALSE,Do you approve or disapprove of the way Donald Trump is handling the following issues? Coronavirus/COVID-19,83,13,https://fingfx.thomsonreuters.com/gfx/mkt/13/3885/3841/Topline%20Reuters%20Coronavirus%2003%2024%202020.pdf
2020-03-18,2020-03-24,Ipsos (online),Reuters,1981,a,D,Trump,FALSE,Do you approve or disapprove of the way Donald Trump is handling the following issues? Coronavirus/COVID-19,24,71,https://fingfx.thomsonreuters.com/gfx/mkt/13/3885/3841/Topline%20Reuters%20Coronavirus%2003%2024%202020.pdf
2020-03-18,2020-03-24,Ipsos (online),Reuters,428,a,I,Trump,FALSE,Do you approve or disapprove of the way Donald Trump is handling the following issues? Coronavirus/COVID-19,43,43,https://fingfx.thomsonreuters.com/gfx/mkt/13/3885/3841/Topline%20Reuters%20Coronavirus%2003%2024%202020.pdf
2020-03-19,2020-03-22,Rasmussen (Pulse Opinion Research),"",1000,lv,all,Trump,FALSE,How would you rate President Trump's response to the coronavirus threat?,45,54,https://www.rasmussenreports.com/platinum/political_tracking_crosstabs/march_2020/crosstabs_trump_response_to_coronavirus_march_19_and_22_2020
2020-03-19,2020-03-22,Rasmussen (Pulse Opinion Research),"",330,lv,R,Trump,FALSE,How would you rate President Trump's response to the coronavirus threat?,77,22,https://www.rasmussenreports.com/platinum/political_tracking_crosstabs/march_2020/crosstabs_trump_response_to_coronavirus_march_19_and_22_2020
2020-03-19,2020-03-22,Rasmussen (Pulse Opinion Research),"",370,lv,D,Trump,FALSE,How would you rate President Trump's response to the coronavirus threat?,25,72,https://www.rasmussenreports.com/platinum/political_tracking_crosstabs/march_2020/crosstabs_trump_response_to_coronavirus_march_19_and_22_2020
2020-03-19,2020-03-22,Rasmussen (Pulse Opinion Research),"",300,lv,I,Trump,FALSE,How would you rate President Trump's response to the coronavirus threat?,34,65,https://www.rasmussenreports.com/platinum/political_tracking_crosstabs/march_2020/crosstabs_trump_response_to_coronavirus_march_19_and_22_2020
2020-03-19,2020-03-24,Pew,"",11537,a,all,Trump,FALSE,How would you rate the job each of the following is doing responding to the coronavirus outbreak? Donald Trump,48,51,https://www.people-press.org/wp-content/uploads/sites/4/2020/03/PP_2020.03.26_Coronavirus-Impact_FINAL.pdf
2020-03-19,2020-03-24,Pew,"",4738,a,R,Trump,FALSE,How would you rate the job each of the following is doing responding to the coronavirus outbreak? Donald Trump,83,17,https://www.people-press.org/wp-content/uploads/sites/4/2020/03/PP_2020.03.26_Coronavirus-Impact_FINAL.pdf
2020-03-19,2020-03-24,Pew,"",6474,a,D,Trump,FALSE,How would you rate the job each of the following is doing responding to the coronavirus outbreak? Donald Trump,18,81,https://www.people-press.org/wp-content/uploads/sites/4/2020/03/PP_2020.03.26_Coronavirus-Impact_FINAL.pdf
2020-03-19,2020-03-25,Nationscape,"",8000,a,all,Trump,FALSE,Do you approve or disapprove of Donald Trump’s handling of the coronavirus outbreak?,59,41,https://www.voterstudygroup.org/covid-19-updates
2020-03-19,2020-03-25,Nationscape,"",2300,a,R,Trump,FALSE,Do you approve or disapprove of Donald Trump’s handling of the coronavirus outbreak?,89,12,https://www.voterstudygroup.org/covid-19-updates
2020-03-19,2020-03-25,Nationscape,"",2800,a,D,Trump,FALSE,Do you approve or disapprove of Donald Trump’s handling of the coronavirus outbreak?,34,66,https://www.voterstudygroup.org/covid-19-updates
2020-03-19,2020-03-25,Nationscape,"",2300,a,I,Trump,FALSE,Do you approve or disapprove of Donald Trump’s handling of the coronavirus outbreak?,59,42,https://www.voterstudygroup.org/covid-19-updates
2020-03-20,2020-03-22,Morning Consult,"",2200,a,all,Trump,FALSE,Do you approve or disapprove of the job each of the following is doing in handling the spread of coronavirus in the United States? President Donald Trump,49,40,https://morningconsult.com/wp-content/uploads/2020/03/200383_crosstabs_CORONAVIRUS_CONTENT_Adults_v4_JB.pdf
2020-03-20,2020-03-22,Morning Consult,"",709,a,R,Trump,FALSE,Do you approve or disapprove of the job each of the following is doing in handling the spread of coronavirus in the United States? President Donald Trump,85,7,https://morningconsult.com/wp-content/uploads/2020/03/200383_crosstabs_CORONAVIRUS_CONTENT_Adults_v4_JB.pdf
2020-03-20,2020-03-22,Morning Consult,"",800,a,D,Trump,FALSE,Do you approve or disapprove of the job each of the following is doing in handling the spread of coronavirus in the United States? President Donald Trump,25,67,https://morningconsult.com/wp-content/uploads/2020/03/200383_crosstabs_CORONAVIRUS_CONTENT_Adults_v4_JB.pdf
2020-03-20,2020-03-22,Morning Consult,"",690,a,I,Trump,FALSE,Do you approve or disapprove of the job each of the following is doing in handling the spread of coronavirus in the United States? President Donald Trump,42,45,https://morningconsult.com/wp-content/uploads/2020/03/200383_crosstabs_CORONAVIRUS_CONTENT_Adults_v4_JB.pdf
2020-03-20,2020-03-22,Morning Consult,Politico,1996,rv,all,Trump,FALSE,How would you rate each of the following on their handling of the coronavirus? President Donald Trump,42,52,https://morningconsult.com/wp-content/uploads/2020/03/200386_crosstabs_POLITICO_RVs.pdf
2020-03-20,2020-03-22,Morning Consult,Politico,659,rv,R,Trump,FALSE,How would you rate each of the following on their handling of the coronavirus? President Donald Trump,81,16,https://morningconsult.com/wp-content/uploads/2020/03/200386_crosstabs_POLITICO_RVs.pdf
2020-03-20,2020-03-22,Morning Consult,Politico,758,rv,D,Trump,FALSE,How would you rate each of the following on their handling of the coronavirus? President Donald Trump,14,81,https://morningconsult.com/wp-content/uploads/2020/03/200386_crosstabs_POLITICO_RVs.pdf
2020-03-20,2020-03-22,Morning Consult,Politico,580,rv,I,Trump,FALSE,How would you rate each of the following on their handling of the coronavirus? President Donald Trump,37,55,https://morningconsult.com/wp-content/uploads/2020/03/200386_crosstabs_POLITICO_RVs.pdf
2020-03-20,2020-03-22,YouGov,Huffington Post,1000,a,all,Trump,FALSE,Do you approve or disapprove of the way President Trump is handling issues related to the coronavirus?,49,42,https://big.assets.huffingtonpost.com/athena/files/2020/03/24/5e7a4240c5b63c3b6498205f.pdf
2020-03-20,2020-03-22,YouGov,Huffington Post,250,a,R,Trump,FALSE,Do you approve or disapprove of the way President Trump is handling issues related to the coronavirus?,85,11,https://big.assets.huffingtonpost.com/athena/files/2020/03/24/5e7a4240c5b63c3b6498205f.pdf
2020-03-20,2020-03-22,YouGov,Huffington Post,340,a,D,Trump,FALSE,Do you approve or disapprove of the way President Trump is handling issues related to the coronavirus?,27,68,https://big.assets.huffingtonpost.com/athena/files/2020/03/24/5e7a4240c5b63c3b6498205f.pdf
2020-03-20,2020-03-22,YouGov,Huffington Post,409,a,I,Trump,FALSE,Do you approve or disapprove of the way President Trump is handling issues related to the coronavirus?,40,43,https://big.assets.huffingtonpost.com/athena/files/2020/03/24/5e7a4240c5b63c3b6498205f.pdf
2020-03-20,2020-03-23,Global Strategy Group/GBAO/Navigator Research,"",1038,rv,all,Trump,TRUE,Do you approve or disapprove of the way that Donald Trump is handling the coronavirus pandemic?,52,42,https://navigatorresearch.org/wp-content/uploads/2020/03/Navigator-Daily-Tracker-Topline-F03.23.20.pdf
2020-03-20,2020-03-23,Global Strategy Group/GBAO/Navigator Research,"",363.3,rv,R,Trump,TRUE,Do you approve or disapprove of the way that Donald Trump is handling the coronavirus pandemic?,89,7,https://navigatorresearch.org/wp-content/uploads/2020/03/Navigator-Daily-Tracker-Topline-F03.23.20.pdf
2020-03-20,2020-03-23,Global Strategy Group/GBAO/Navigator Research,"",435.96,rv,D,Trump,TRUE,Do you approve or disapprove of the way that Donald Trump is handling the coronavirus pandemic?,24,72,https://navigatorresearch.org/wp-content/uploads/2020/03/Navigator-Daily-Tracker-Topline-F03.23.20.pdf
2020-03-20,2020-03-23,Global Strategy Group/GBAO/Navigator Research,"",238.74,rv,I,Trump,TRUE,Do you approve or disapprove of the way that Donald Trump is handling the coronavirus pandemic?,45,38,https://navigatorresearch.org/wp-content/uploads/2020/03/Navigator-Daily-Tracker-Topline-F03.23.20.pdf
2020-03-20,2020-03-24,Echelon Insights,"",1000,rv,all,Trump,FALSE,Do you approve or disapprove of the way Donald Trump is handling the spread of the coronavirus in the United States?,52,44,http://echeloninsights.com/wp-content/uploads/Omnibus_March-2020_COVID.pdf
2020-03-21,2020-03-22,Harris Poll,"",2023,a,all,Trump,FALSE,How much do you approve or disapprove of the job President Trump is doing on each of the following? Handling coronavirus (COVID-19),55,45,https://theharrispoll.com/wp-content/uploads/2020/03/COVID-19-Tracker_Wave-2-4_tabs.pdf
2020-03-21,2020-03-22,Harris Poll,"",661,a,R,Trump,FALSE,How much do you approve or disapprove of the job President Trump is doing on each of the following? Handling coronavirus (COVID-19),87,13,https://theharrispoll.com/wp-content/uploads/2020/03/COVID-19-Tracker_Wave-2-4_tabs.pdf
2020-03-21,2020-03-22,Harris Poll,"",699,a,D,Trump,FALSE,How much do you approve or disapprove of the job President Trump is doing on each of the following? Handling coronavirus (COVID-19),32,68,https://theharrispoll.com/wp-content/uploads/2020/03/COVID-19-Tracker_Wave-2-4_tabs.pdf
2020-03-21,2020-03-22,Harris Poll,"",663,a,I,Trump,FALSE,How much do you approve or disapprove of the job President Trump is doing on each of the following? Handling coronavirus (COVID-19),50,50,https://theharrispoll.com/wp-content/uploads/2020/03/COVID-19-Tracker_Wave-2-4_tabs.pdf
2020-03-21,2020-03-23,YouGov,CBS News,2190,a,all,Trump,FALSE,How would you rate the job Donald Trump is doing handling the coronavirus outbreak?,53,47,https://drive.google.com/file/d/1TofJVeuCbZN8cRGBN97kWGqhO6tlQ7VA/view
2020-03-21,2020-03-23,YouGov,CBS News,507,a,R,Trump,FALSE,How would you rate the job Donald Trump is doing handling the coronavirus outbreak?,91,9,https://drive.google.com/file/d/1TofJVeuCbZN8cRGBN97kWGqhO6tlQ7VA/view
2020-03-21,2020-03-23,YouGov,CBS News,693,a,D,Trump,FALSE,How would you rate the job Donald Trump is doing handling the coronavirus outbreak?,22,78,https://drive.google.com/file/d/1TofJVeuCbZN8cRGBN97kWGqhO6tlQ7VA/view
2020-03-21,2020-03-23,YouGov,CBS News,706,a,I,Trump,FALSE,How would you rate the job Donald Trump is doing handling the coronavirus outbreak?,54,47,https://drive.google.com/file/d/1TofJVeuCbZN8cRGBN97kWGqhO6tlQ7VA/view
2020-03-21,2020-03-24,Fox News,"",1011,rv,all,Trump,FALSE,Do you approve or disapprove of the way each of the following have responded to the coronavirus outbreak? President Donald Trump,51,46,https://www.scribd.com/document/453417322/Fox-News-Poll-March-21-24-2020
2020-03-21,2020-03-24,Fox News,"",404.4,rv,R,Trump,FALSE,Do you approve or disapprove of the way each of the following have responded to the coronavirus outbreak? President Donald Trump,86,13,https://www.scribd.com/document/453417322/Fox-News-Poll-March-21-24-2020
2020-03-21,2020-03-24,Fox News,"",495.39,rv,D,Trump,FALSE,Do you approve or disapprove of the way each of the following have responded to the coronavirus outbreak? President Donald Trump,24,74,https://www.scribd.com/document/453417322/Fox-News-Poll-March-21-24-2020
2020-03-21,2020-03-24,Fox News,"",111.21,rv,I,Trump,FALSE,Do you approve or disapprove of the way each of the following have responded to the coronavirus outbreak? President Donald Trump,46,47,https://www.scribd.com/document/453417322/Fox-News-Poll-March-21-24-2020
2020-03-21,2020-03-24,Global Strategy Group/GBAO/Navigator Research,"",1012,rv,all,Trump,TRUE,Do you approve or disapprove of the way that Donald Trump is handling the coronavirus pandemic?,52,43,https://navigatorresearch.org/wp-content/uploads/2020/03/Navigator-Daily-Tracker-Topline-F03.24.20.pdf
2020-03-21,2020-03-24,Global Strategy Group/GBAO/Navigator Research,"",354.2,rv,R,Trump,TRUE,Do you approve or disapprove of the way that Donald Trump is handling the coronavirus pandemic?,88,8,https://navigatorresearch.org/wp-content/uploads/2020/03/Navigator-Daily-Tracker-Topline-F03.24.20.pdf
2020-03-21,2020-03-24,Global Strategy Group/GBAO/Navigator Research,"",425.04,rv,D,Trump,TRUE,Do you approve or disapprove of the way that Donald Trump is handling the coronavirus pandemic?,23,73,https://navigatorresearch.org/wp-content/uploads/2020/03/Navigator-Daily-Tracker-Topline-F03.24.20.pdf
2020-03-21,2020-03-24,Global Strategy Group/GBAO/Navigator Research,"",232.76,rv,I,Trump,TRUE,Do you approve or disapprove of the way that Donald Trump is handling the coronavirus pandemic?,48,43,https://navigatorresearch.org/wp-content/uploads/2020/03/Navigator-Daily-Tracker-Topline-F03.24.20.pdf
2020-03-21,2020-03-28,Firehouse Strategies/Øptimus,"",2343,a,all,Trump,TRUE,"In general, do you approve or disapprove of President Donald Trump’s handling of the coronavirus outbreak?",50.7,49.3,https://github.com/optimus-forecasting-and-polling/Firehouse-0ptimus-Coronavirus-Tracking/tree/master/April-13-2020
2020-03-22,2020-03-23,HarrisX,Hill.TV,1002,rv,all,Trump,FALSE,Do you approve or disapprove of the job President Trump is doing on handling the coronavirus outbreak?,56,44,https://thehill.com/hilltv/what-americas-thinking/489920-poll-trumps-approval-on-coronavirus-drops-after-calls-to-reopen
2020-03-22,2020-03-23,HarrisX,Hill.TV,321,rv,R,Trump,FALSE,Do you approve or disapprove of the job President Trump is doing on handling the coronavirus outbreak?,86,14,https://thehill.com/hilltv/what-americas-thinking/489920-poll-trumps-approval-on-coronavirus-drops-after-calls-to-reopen
2020-03-22,2020-03-23,HarrisX,Hill.TV,371,rv,D,Trump,FALSE,Do you approve or disapprove of the job President Trump is doing on handling the coronavirus outbreak?,30,70,https://thehill.com/hilltv/what-americas-thinking/489920-poll-trumps-approval-on-coronavirus-drops-after-calls-to-reopen
2020-03-22,2020-03-23,HarrisX,Hill.TV,291,rv,I,Trump,FALSE,Do you approve or disapprove of the job President Trump is doing on handling the coronavirus outbreak?,55,45,https://thehill.com/hilltv/what-americas-thinking/489920-poll-trumps-approval-on-coronavirus-drops-after-calls-to-reopen
2020-03-22,2020-03-24,Benenson,"",1500,a,all,Trump,FALSE,"For each of the following people or groups, how well are each of them dealing with the coronavirus? President Trump",45,55,https://ac32b1ba-8f5b-411f-91ab-b7ae9a046606.usrfiles.com/ugd/ac32b1_a922a83f6bd4431685464a234d957670.pdf
2020-03-22,2020-03-24,YouGov,Economist,1500,a,all,Trump,FALSE,Do you approve or disapprove of Donald Trump’s handling of the coronavirus outbreak?,48,44,https://docs.cdn.yougov.com/bfiid7tfh3/econTabReport.pdf
2020-03-22,2020-03-24,YouGov,Economist,399,a,R,Trump,FALSE,Do you approve or disapprove of Donald Trump’s handling of the coronavirus outbreak?,89,7,https://docs.cdn.yougov.com/bfiid7tfh3/econTabReport.pdf
2020-03-22,2020-03-24,YouGov,Economist,502,a,D,Trump,FALSE,Do you approve or disapprove of Donald Trump’s handling of the coronavirus outbreak?,21,74,https://docs.cdn.yougov.com/bfiid7tfh3/econTabReport.pdf
2020-03-22,2020-03-24,YouGov,Economist,593,a,I,Trump,FALSE,Do you approve or disapprove of Donald Trump’s handling of the coronavirus outbreak?,42,45,https://docs.cdn.yougov.com/bfiid7tfh3/econTabReport.pdf
2020-03-22,2020-03-25,ABC,"",1003,a,all,Trump,FALSE,Do you approve or disapprove of the way Trump is handling the coronavirus outbreak?,51,45,https://www.washingtonpost.com/context/washington-post-abc-news-poll-march-22-25-2020/974c3312-5a40-4764-afb1-4bb6b86f1cf4/
2020-03-22,2020-03-25,ABC,"",243,a,R,Trump,FALSE,Do you approve or disapprove of the way Trump is handling the coronavirus outbreak?,86,12,https://www.washingtonpost.com/context/washington-post-abc-news-poll-march-22-25-2020/974c3312-5a40-4764-afb1-4bb6b86f1cf4/
2020-03-22,2020-03-25,ABC,"",305,a,D,Trump,FALSE,Do you approve or disapprove of the way Trump is handling the coronavirus outbreak?,17,78,https://www.washingtonpost.com/context/washington-post-abc-news-poll-march-22-25-2020/974c3312-5a40-4764-afb1-4bb6b86f1cf4/
2020-03-22,2020-03-25,ABC,"",354,a,I,Trump,FALSE,Do you approve or disapprove of the way Trump is handling the coronavirus outbreak?,49,45,https://www.washingtonpost.com/context/washington-post-abc-news-poll-march-22-25-2020/974c3312-5a40-4764-afb1-4bb6b86f1cf4/
2020-03-22,2020-03-25,Global Strategy Group/GBAO/Navigator Research,"",1003,rv,all,Trump,TRUE,Do you approve or disapprove of the way that Donald Trump is handling the coronavirus pandemic?,48,48,https://navigatorresearch.org/wp-content/uploads/2020/03/Navigator-Daily-Tracker-Topline-F03.25.20.pdf
2020-03-22,2020-03-25,Global Strategy Group/GBAO/Navigator Research,"",351.05,rv,R,Trump,TRUE,Do you approve or disapprove of the way that Donald Trump is handling the coronavirus pandemic?,84,11,https://navigatorresearch.org/wp-content/uploads/2020/03/Navigator-Daily-Tracker-Topline-F03.25.20.pdf
2020-03-22,2020-03-25,Global Strategy Group/GBAO/Navigator Research,"",421.26,rv,D,Trump,TRUE,Do you approve or disapprove of the way that Donald Trump is handling the coronavirus pandemic?,18,78,https://navigatorresearch.org/wp-content/uploads/2020/03/Navigator-Daily-Tracker-Topline-F03.25.20.pdf
2020-03-22,2020-03-25,Global Strategy Group/GBAO/Navigator Research,"",230.69,rv,I,Trump,TRUE,Do you approve or disapprove of the way that Donald Trump is handling the coronavirus pandemic?,42,51,https://navigatorresearch.org/wp-content/uploads/2020/03/Navigator-Daily-Tracker-Topline-F03.25.20.pdf
2020-03-23,2020-03-23,Redfield & Wilton Strategies,"",1500,rv,all,Trump,FALSE,To what extent do you approve or disapprove of President Donald Trump’s handling of the coronavirus crisis?,46,37,https://redfieldandwiltonstrategies.com/research/us-public-taking-coronavirus-more-seriously/
2020-03-23,2020-03-26,Global Strategy Group/GBAO/Navigator Research,"",1005,rv,all,Trump,TRUE,Do you approve or disapprove of the way that Donald Trump is handling the coronavirus pandemic?,49,49,https://navigatorresearch.org/wp-content/uploads/2020/03/Navigator-Daily-Tracker-Topline-F03.26.20.pdf
2020-03-23,2020-03-26,Global Strategy Group/GBAO/Navigator Research,"",361.8,rv,R,Trump,TRUE,Do you approve or disapprove of the way that Donald Trump is handling the coronavirus pandemic?,87,11,https://navigatorresearch.org/wp-content/uploads/2020/03/Navigator-Daily-Tracker-Topline-F03.26.20.pdf
2020-03-23,2020-03-26,Global Strategy Group/GBAO/Navigator Research,"",422.1,rv,D,Trump,TRUE,Do you approve or disapprove of the way that Donald Trump is handling the coronavirus pandemic?,17,82,https://navigatorresearch.org/wp-content/uploads/2020/03/Navigator-Daily-Tracker-Topline-F03.26.20.pdf
2020-03-23,2020-03-26,Global Strategy Group/GBAO/Navigator Research,"",221.1,rv,I,Trump,TRUE,Do you approve or disapprove of the way that Donald Trump is handling the coronavirus pandemic?,47,43,https://navigatorresearch.org/wp-content/uploads/2020/03/Navigator-Daily-Tracker-Topline-F03.26.20.pdf
2020-03-23,2020-03-26,McLaughlin,"",1000,lv,all,Trump,FALSE,Do you approve or disapprove of the way President Donald Trump is handling the Coronavirus situation?,53,45,https://mclaughlinonline.com/pols/wp-content/uploads/2020/03/National-Monthly-Omnibus-MARCH-PUBLIC.pdf
2020-03-23,2020-03-26,McLaughlin,"",330,lv,R,Trump,FALSE,Do you approve or disapprove of the way President Donald Trump is handling the Coronavirus situation?,88,11,https://mclaughlinonline.com/pols/wp-content/uploads/2020/03/National-Monthly-Omnibus-MARCH-PUBLIC.pdf
2020-03-23,2020-03-26,McLaughlin,"",360,lv,D,Trump,FALSE,Do you approve or disapprove of the way President Donald Trump is handling the Coronavirus situation?,25,72,https://mclaughlinonline.com/pols/wp-content/uploads/2020/03/National-Monthly-Omnibus-MARCH-PUBLIC.pdf
2020-03-23,2020-03-26,McLaughlin,"",310,lv,I,Trump,FALSE,Do you approve or disapprove of the way President Donald Trump is handling the Coronavirus situation?,47,48,https://mclaughlinonline.com/pols/wp-content/uploads/2020/03/National-Monthly-Omnibus-MARCH-PUBLIC.pdf
2020-03-24,2020-03-25,Echelon Insights,"",601,a,all,Trump,FALSE,Are you satisfied or dissatisfied with the way Donald Trump is handling the coronavirus outbreak?,53,42,https://twitter.com/EchelonInsights/status/1243156456159010817
2020-03-24,2020-03-25,SurveyUSA,"",1000,a,all,Trump,FALSE,"Do you approve or disapprove of way President Donald Trump is handling COVID-19, the Coronavirus?",53,44,http://www.surveyusa.com/client/PollReport.aspx?g=a6354d34-2350-49a3-b360-8772ca176a2d
2020-03-24,2020-03-25,SurveyUSA,"",333,a,R,Trump,FALSE,"Do you approve or disapprove of way President Donald Trump is handling COVID-19, the Coronavirus?",91,8,http://www.surveyusa.com/client/PollReport.aspx?g=a6354d34-2350-49a3-b360-8772ca176a2d
2020-03-24,2020-03-25,SurveyUSA,"",371,a,D,Trump,FALSE,"Do you approve or disapprove of way President Donald Trump is handling COVID-19, the Coronavirus?",22,76,http://www.surveyusa.com/client/PollReport.aspx?g=a6354d34-2350-49a3-b360-8772ca176a2d
2020-03-24,2020-03-25,SurveyUSA,"",242,a,I,Trump,FALSE,"Do you approve or disapprove of way President Donald Trump is handling COVID-19, the Coronavirus?",49,46,http://www.surveyusa.com/client/PollReport.aspx?g=a6354d34-2350-49a3-b360-8772ca176a2d
2020-03-24,2020-03-26,Harris Poll,Harvard,2410,rv,all,Trump,FALSE,Do you approve or disapprove of the job President Trump is doing on ...? Reacting to coronavirus,50,50,https://harvardharrispoll.com/wp-content/uploads/2020/03/HHP_March2020_RegisteredVoters_Crosstabs.pdf
2020-03-24,2020-03-26,Harris Poll,Harvard,782,rv,R,Trump,FALSE,Do you approve or disapprove of the job President Trump is doing on ...? Reacting to coronavirus,83,17,https://harvardharrispoll.com/wp-content/uploads/2020/03/HHP_March2020_RegisteredVoters_Crosstabs.pdf
2020-03-24,2020-03-26,Harris Poll,Harvard,903,rv,D,Trump,FALSE,Do you approve or disapprove of the job President Trump is doing on ...? Reacting to coronavirus,24,76,https://harvardharrispoll.com/wp-content/uploads/2020/03/HHP_March2020_RegisteredVoters_Crosstabs.pdf
2020-03-24,2020-03-26,Harris Poll,Harvard,647,rv,I,Trump,FALSE,Do you approve or disapprove of the job President Trump is doing on ...? Reacting to coronavirus,47,53,https://harvardharrispoll.com/wp-content/uploads/2020/03/HHP_March2020_RegisteredVoters_Crosstabs.pdf
2020-03-24,2020-03-26,Harris Poll,Harvard,2410,rv,all,Trump,FALSE,How are each of the following people or entities handling their response to the spread of the coronavirus in the US? President Trump,44,56,https://harvardharrispoll.com/wp-content/uploads/2020/03/HHP_March2020_RegisteredVoters_Crosstabs.pdf
2020-03-24,2020-03-26,Harris Poll,Harvard,782,rv,R,Trump,FALSE,How are each of the following people or entities handling their response to the spread of the coronavirus in the US? President Trump,78,22,https://harvardharrispoll.com/wp-content/uploads/2020/03/HHP_March2020_RegisteredVoters_Crosstabs.pdf
2020-03-24,2020-03-26,Harris Poll,Harvard,903,rv,D,Trump,FALSE,How are each of the following people or entities handling their response to the spread of the coronavirus in the US? President Trump,18,82,https://harvardharrispoll.com/wp-content/uploads/2020/03/HHP_March2020_RegisteredVoters_Crosstabs.pdf
2020-03-24,2020-03-26,Harris Poll,Harvard,647,rv,I,Trump,FALSE,How are each of the following people or entities handling their response to the spread of the coronavirus in the US? President Trump,40,60,https://harvardharrispoll.com/wp-content/uploads/2020/03/HHP_March2020_RegisteredVoters_Crosstabs.pdf
2020-03-24,2020-03-26,Morning Consult,"",2200,a,all,Trump,FALSE,Do you approve or disapprove of the job each of the following is doing in handling the spread of coronavirus in the United States? President Donald Trump,50,41,https://morningconsult.com/wp-content/uploads/2020/03/200394_crosstabs_CORONAVIRUS_CONTENT_Adults_v4_JB.pdf
2020-03-24,2020-03-26,Morning Consult,"",689,a,R,Trump,FALSE,Do you approve or disapprove of the job each of the following is doing in handling the spread of coronavirus in the United States? President Donald Trump,85,11,https://morningconsult.com/wp-content/uploads/2020/03/200394_crosstabs_CORONAVIRUS_CONTENT_Adults_v4_JB.pdf
2020-03-24,2020-03-26,Morning Consult,"",782,a,D,Trump,FALSE,Do you approve or disapprove of the job each of the following is doing in handling the spread of coronavirus in the United States? President Donald Trump,22,72,https://morningconsult.com/wp-content/uploads/2020/03/200394_crosstabs_CORONAVIRUS_CONTENT_Adults_v4_JB.pdf
2020-03-24,2020-03-26,Morning Consult,"",729,a,I,Trump,FALSE,Do you approve or disapprove of the job each of the following is doing in handling the spread of coronavirus in the United States? President Donald Trump,47,38,https://morningconsult.com/wp-content/uploads/2020/03/200394_crosstabs_CORONAVIRUS_CONTENT_Adults_v4_JB.pdf
2020-03-24,2020-03-26,Zogby (Internet),"",889,lv,all,Trump,FALSE,Handling of the Coronavirus pandemic so far... President Donald Trump,49,51,https://zogbyanalytics.com/news/927-the-zogby-poll-voters-give-a-slight-edge-to-trump-versus-biden-in-who-is-better-equipped-to-handle-pandemic-cuomo-is-the-highest-rated-politician-at-handling-the-coronavirus-crisis-trump-rated-higher-than-sanders-and-biden-for-his-response-to-the-pandemic
2020-03-24,2020-03-27,Global Strategy Group/GBAO/Navigator Research,"",1022,rv,all,Trump,TRUE,Do you approve or disapprove of the way that Donald Trump is handling the coronavirus pandemic?,47,50,https://navigatorresearch.org/wp-content/uploads/2020/03/Navigator-Daily-Tracker-Topline-F03.27.20.pdf
2020-03-24,2020-03-27,Global Strategy Group/GBAO/Navigator Research,"",357.7,rv,R,Trump,TRUE,Do you approve or disapprove of the way that Donald Trump is handling the coronavirus pandemic?,85,13,https://navigatorresearch.org/wp-content/uploads/2020/03/Navigator-Daily-Tracker-Topline-F03.27.20.pdf
2020-03-24,2020-03-27,Global Strategy Group/GBAO/Navigator Research,"",429.24,rv,D,Trump,TRUE,Do you approve or disapprove of the way that Donald Trump is handling the coronavirus pandemic?,16,81,https://navigatorresearch.org/wp-content/uploads/2020/03/Navigator-Daily-Tracker-Topline-F03.27.20.pdf
2020-03-24,2020-03-27,Global Strategy Group/GBAO/Navigator Research,"",235.06,rv,I,Trump,TRUE,Do you approve or disapprove of the way that Donald Trump is handling the coronavirus pandemic?,46,44,https://navigatorresearch.org/wp-content/uploads/2020/03/Navigator-Daily-Tracker-Topline-F03.27.20.pdf
2020-03-25,2020-03-26,YouGov,Yahoo News,1579,a,all,Trump,FALSE,Do you approve or disapprove of the way President Trump has handled coronavirus?,43,49,https://docs.cdn.yougov.com/69501vybsd/20200326_yahoo_coronavirus_crosstabs.pdf
2020-03-25,2020-03-26,YouGov,Yahoo News,355,a,R,Trump,FALSE,Do you approve or disapprove of the way President Trump has handled coronavirus?,84,13,https://docs.cdn.yougov.com/69501vybsd/20200326_yahoo_coronavirus_crosstabs.pdf
2020-03-25,2020-03-26,YouGov,Yahoo News,565,a,D,Trump,FALSE,Do you approve or disapprove of the way President Trump has handled coronavirus?,17,79,https://docs.cdn.yougov.com/69501vybsd/20200326_yahoo_coronavirus_crosstabs.pdf
2020-03-25,2020-03-26,YouGov,Yahoo News,659,a,I,Trump,FALSE,Do you approve or disapprove of the way President Trump has handled coronavirus?,40,44,https://docs.cdn.yougov.com/69501vybsd/20200326_yahoo_coronavirus_crosstabs.pdf
2020-03-25,2020-03-30,Global Strategy Group/GBAO/Navigator Research,"",1017,rv,all,Trump,TRUE,Do you approve or disapprove of the way that Donald Trump is handling the coronavirus pandemic?,49,48,https://navigatorresearch.org/wp-content/uploads/2020/03/Navigator-Daily-Tracker-Topline-F03.30.20.pdf
2020-03-25,2020-03-30,Global Strategy Group/GBAO/Navigator Research,"",366.12,rv,R,Trump,TRUE,Do you approve or disapprove of the way that Donald Trump is handling the coronavirus pandemic?,85,14,https://navigatorresearch.org/wp-content/uploads/2020/03/Navigator-Daily-Tracker-Topline-F03.30.20.pdf
2020-03-25,2020-03-30,Global Strategy Group/GBAO/Navigator Research,"",427.14,rv,D,Trump,TRUE,Do you approve or disapprove of the way that Donald Trump is handling the coronavirus pandemic?,19,79,https://navigatorresearch.org/wp-content/uploads/2020/03/Navigator-Daily-Tracker-Topline-F03.30.20.pdf
2020-03-25,2020-03-30,Global Strategy Group/GBAO/Navigator Research,"",223.74,rv,I,Trump,TRUE,Do you approve or disapprove of the way that Donald Trump is handling the coronavirus pandemic?,53,36,https://navigatorresearch.org/wp-content/uploads/2020/03/Navigator-Daily-Tracker-Topline-F03.30.20.pdf
2020-03-25,2020-03-30,Kaiser Family Foundation,"",1226,a,all,Trump,FALSE,Do you approve or disapprove of the way President Trump is handling the current coronavirus outbreak in the U.S.?,50,47,https://www.kff.org/wp-content/uploads/2020/04/Kaiser-Health-Tracking-Poll_Early-April_Full-Topline_FINAL.pdf
2020-03-25,2020-03-30,Kaiser Family Foundation,"",311,a,R,Trump,FALSE,Do you approve or disapprove of the way President Trump is handling the current coronavirus outbreak in the U.S.?,87,11,https://www.kff.org/wp-content/uploads/2020/04/Kaiser-Health-Tracking-Poll_Early-April_Full-Topline_FINAL.pdf
2020-03-25,2020-03-30,Kaiser Family Foundation,"",364,a,D,Trump,FALSE,Do you approve or disapprove of the way President Trump is handling the current coronavirus outbreak in the U.S.?,21,77,https://www.kff.org/wp-content/uploads/2020/04/Kaiser-Health-Tracking-Poll_Early-April_Full-Topline_FINAL.pdf
2020-03-25,2020-03-30,Kaiser Family Foundation,"",418,a,I,Trump,FALSE,Do you approve or disapprove of the way President Trump is handling the current coronavirus outbreak in the U.S.?,51,45,https://www.kff.org/wp-content/uploads/2020/04/Kaiser-Health-Tracking-Poll_Early-April_Full-Topline_FINAL.pdf
2020-03-25,2020-03-30,YouGov,More in Common,2000,a,all,Trump,FALSE,Do you approve or disapprove of the way President Trump is handling the coronavirus pandemic in the United States?,51,49,https://www.moreincommon.com/media/z4fdmdpa/hidden-tribes_covid-19-polarization-and-the-pandemic-4-3-20.pdf
2020-03-25,2020-03-30,YouGov,More in Common,491,a,R,Trump,FALSE,Do you approve or disapprove of the way President Trump is handling the coronavirus pandemic in the United States?,94,6,https://www.moreincommon.com/media/z4fdmdpa/hidden-tribes_covid-19-polarization-and-the-pandemic-4-3-20.pdf
2020-03-25,2020-03-30,YouGov,More in Common,765,a,D,Trump,FALSE,Do you approve or disapprove of the way President Trump is handling the coronavirus pandemic in the United States?,18,83,https://www.moreincommon.com/media/z4fdmdpa/hidden-tribes_covid-19-polarization-and-the-pandemic-4-3-20.pdf
2020-03-25,2020-03-30,YouGov,More in Common,491,a,I,Trump,FALSE,Do you approve or disapprove of the way President Trump is handling the coronavirus pandemic in the United States?,55,44,https://www.moreincommon.com/media/z4fdmdpa/hidden-tribes_covid-19-polarization-and-the-pandemic-4-3-20.pdf
2020-03-26,2020-03-27,HarrisX,Hill.TV,948,rv,all,Trump,FALSE,Do you approve or disapprove of the job President Trump is doing on handling the coronavirus outbreak?,50,50,https://thehill.com/hilltv/what-americas-thinking/489920-poll-trumps-approval-on-coronavirus-drops-after-calls-to-reopen
2020-03-26,2020-03-27,HarrisX,Hill.TV,303,rv,R,Trump,FALSE,Do you approve or disapprove of the job President Trump is doing on handling the coronavirus outbreak?,76,24,https://thehill.com/hilltv/what-americas-thinking/489920-poll-trumps-approval-on-coronavirus-drops-after-calls-to-reopen
2020-03-26,2020-03-27,HarrisX,Hill.TV,351,rv,D,Trump,FALSE,Do you approve or disapprove of the job President Trump is doing on handling the coronavirus outbreak?,29,71,https://thehill.com/hilltv/what-americas-thinking/489920-poll-trumps-approval-on-coronavirus-drops-after-calls-to-reopen
2020-03-26,2020-03-27,HarrisX,Hill.TV,275,rv,I,Trump,FALSE,Do you approve or disapprove of the job President Trump is doing on handling the coronavirus outbreak?,48,52,https://thehill.com/hilltv/what-americas-thinking/489920-poll-trumps-approval-on-coronavirus-drops-after-calls-to-reopen
2020-03-26,2020-03-28,Change Research,"",1845,lv,all,Trump,FALSE,Do you approve or disapprove of the job Donald Trump is doing to manage coronavirus in the U.S.?,45,55,https://www.changeresearch.com/post/national-poll-on-coronavirus
2020-03-26,2020-03-29,AP-NORC,"",1057,a,all,Trump,FALSE,"Overall, do you approve or disapprove of the way Donald Trump is handling … ? Coronavirus outbreak",44,55,http://www.apnorc.org/PDFs/March%20Omnibus%202020/topline_gov.pdf
2020-03-26,2020-03-29,AP-NORC,"",401.66,a,R,Trump,FALSE,"Overall, do you approve or disapprove of the way Donald Trump is handling … ? Coronavirus outbreak",82,17,http://www.apnorc.org/PDFs/March%20Omnibus%202020/topline_gov.pdf
2020-03-26,2020-03-29,AP-NORC,"",486.22,a,D,Trump,FALSE,"Overall, do you approve or disapprove of the way Donald Trump is handling … ? Coronavirus outbreak",14,86,http://www.apnorc.org/PDFs/March%20Omnibus%202020/topline_gov.pdf
2020-03-26,2020-03-29,AP-NORC,"",169.12,a,I,Trump,FALSE,"Overall, do you approve or disapprove of the way Donald Trump is handling … ? Coronavirus outbreak",41,57,http://www.apnorc.org/PDFs/March%20Omnibus%202020/topline_gov.pdf
2020-03-26,2020-03-29,Change Research,Rural Organizing,1213,lv,all,Trump,FALSE,How would you rate the job that Donald Trump is doing on each of the following? - The coronavirus (COVID-19) outbreak,48,52,https://drive.google.com/file/d/1yFA1QCCOFNkt__W9Zog3MaRMj8RJCw_1/view
2020-03-26,2020-03-29,Change Research,Rural Organizing,370,lv,R,Trump,FALSE,How would you rate the job that Donald Trump is doing on each of the following? - The coronavirus (COVID-19) outbreak,90,10,https://drive.google.com/file/d/1yFA1QCCOFNkt__W9Zog3MaRMj8RJCw_1/view
2020-03-26,2020-03-29,Change Research,Rural Organizing,443,lv,D,Trump,FALSE,How would you rate the job that Donald Trump is doing on each of the following? - The coronavirus (COVID-19) outbreak,19,81,https://drive.google.com/file/d/1yFA1QCCOFNkt__W9Zog3MaRMj8RJCw_1/view
2020-03-26,2020-03-29,Change Research,Rural Organizing,400,lv,I,Trump,FALSE,How would you rate the job that Donald Trump is doing on each of the following? - The coronavirus (COVID-19) outbreak,40,60,https://drive.google.com/file/d/1yFA1QCCOFNkt__W9Zog3MaRMj8RJCw_1/view
2020-03-26,2020-03-29,Research America Inc.,"",600,a,all,Trump,FALSE,How satisfied or dissatisfied are you with the response of the following to the coronavirus pandemic? President Donald Trump,43,33,https://projects.fivethirtyeight.com/polls/20200407_National_ResearchAmerica_coronavirus.pdf
2020-03-26,2020-03-29,Research America Inc.,"",120,a,R,Trump,FALSE,How satisfied or dissatisfied are you with the response of the following to the coronavirus pandemic? President Donald Trump,73,"",https://projects.fivethirtyeight.com/polls/20200407_National_ResearchAmerica_coronavirus.pdf
2020-03-26,2020-03-29,Research America Inc.,"",132,a,D,Trump,FALSE,How satisfied or dissatisfied are you with the response of the following to the coronavirus pandemic? President Donald Trump,22,"",https://projects.fivethirtyeight.com/polls/20200407_National_ResearchAmerica_coronavirus.pdf
2020-03-26,2020-03-30,YouGov,American Enterprise Institute,2560,a,all,Trump,FALSE,"How well, if at all, do you think each of the following are handling the Coronavirus (COVID-19) outbreak? Donald Trump",52,48,https://www.aei.org/wp-content/uploads/2020/04/APS-Mar-2020-Topline-Questionnaire.pdf
2020-03-26,2020-03-31,Global Strategy Group/GBAO/Navigator Research,"",1017,rv,all,Trump,TRUE,Do you approve or disapprove of the way that Donald Trump is handling the coronavirus pandemic?,48,48,https://navigatorresearch.org/wp-content/uploads/2020/04/Navigator-Daily-Tracker-Topline-F03.31.20.pdf
2020-03-26,2020-03-31,Global Strategy Group/GBAO/Navigator Research,"",366.12,rv,R,Trump,TRUE,Do you approve or disapprove of the way that Donald Trump is handling the coronavirus pandemic?,83,14,https://navigatorresearch.org/wp-content/uploads/2020/04/Navigator-Daily-Tracker-Topline-F03.31.20.pdf
2020-03-26,2020-03-31,Global Strategy Group/GBAO/Navigator Research,"",427.14,rv,D,Trump,TRUE,Do you approve or disapprove of the way that Donald Trump is handling the coronavirus pandemic?,18,78,https://navigatorresearch.org/wp-content/uploads/2020/04/Navigator-Daily-Tracker-Topline-F03.31.20.pdf
2020-03-26,2020-03-31,Global Strategy Group/GBAO/Navigator Research,"",223.74,rv,I,Trump,TRUE,Do you approve or disapprove of the way that Donald Trump is handling the coronavirus pandemic?,51,38,https://navigatorresearch.org/wp-content/uploads/2020/04/Navigator-Daily-Tracker-Topline-F03.31.20.pdf
2020-03-26,2020-04-01,Nationscape,"",8000,a,all,Trump,FALSE,Do you approve or disapprove of Donald Trump’s handling of the coronavirus outbreak?,53,47,https://www.voterstudygroup.org/covid-19-updates
2020-03-26,2020-04-01,Nationscape,"",2300,a,R,Trump,FALSE,Do you approve or disapprove of Donald Trump’s handling of the coronavirus outbreak?,88,12,https://www.voterstudygroup.org/covid-19-updates
2020-03-26,2020-04-01,Nationscape,"",2800,a,D,Trump,FALSE,Do you approve or disapprove of Donald Trump’s handling of the coronavirus outbreak?,25,74,https://www.voterstudygroup.org/covid-19-updates
2020-03-26,2020-04-01,Nationscape,"",2300,a,I,Trump,FALSE,Do you approve or disapprove of Donald Trump’s handling of the coronavirus outbreak?,49,51,https://www.voterstudygroup.org/covid-19-updates
2020-03-27,2020-03-29,Morning Consult,"",2200,a,all,Trump,FALSE,Do you approve or disapprove of the job each of the following is doing in handling the spread of coronavirus in the United States? President Donald Trump,49,41,https://morningconsult.com/wp-content/uploads/2020/03/2003102_crosstabs_CORONAVIRUS_CONTENT_Adults_v2_JB.pdf
2020-03-27,2020-03-29,Morning Consult,"",694,a,R,Trump,FALSE,Do you approve or disapprove of the job each of the following is doing in handling the spread of coronavirus in the United States? President Donald Trump,85,11,https://morningconsult.com/wp-content/uploads/2020/03/2003102_crosstabs_CORONAVIRUS_CONTENT_Adults_v2_JB.pdf
2020-03-27,2020-03-29,Morning Consult,"",827,a,D,Trump,FALSE,Do you approve or disapprove of the job each of the following is doing in handling the spread of coronavirus in the United States? President Donald Trump,22,69,https://morningconsult.com/wp-content/uploads/2020/03/2003102_crosstabs_CORONAVIRUS_CONTENT_Adults_v2_JB.pdf
2020-03-27,2020-03-29,Morning Consult,"",679,a,I,Trump,FALSE,Do you approve or disapprove of the job each of the following is doing in handling the spread of coronavirus in the United States? President Donald Trump,48,38,https://morningconsult.com/wp-content/uploads/2020/03/2003102_crosstabs_CORONAVIRUS_CONTENT_Adults_v2_JB.pdf
2020-03-27,2020-03-29,Morning Consult,Politico,1997,rv,all,Trump,FALSE,How would you rate each of the following on their handling of the coronavirus? President Donald Trump,43,51,https://morningconsult.com/wp-content/uploads/2020/03/2003101_crosstabs_POLITICO_RVs_v1_AUTO.pdf
2020-03-27,2020-03-29,Morning Consult,Politico,651,rv,R,Trump,FALSE,How would you rate each of the following on their handling of the coronavirus? President Donald Trump,82,13,https://morningconsult.com/wp-content/uploads/2020/03/2003101_crosstabs_POLITICO_RVs_v1_AUTO.pdf
2020-03-27,2020-03-29,Morning Consult,Politico,770,rv,D,Trump,FALSE,How would you rate each of the following on their handling of the coronavirus? President Donald Trump,14,82,https://morningconsult.com/wp-content/uploads/2020/03/2003101_crosstabs_POLITICO_RVs_v1_AUTO.pdf
2020-03-27,2020-03-29,Morning Consult,Politico,576,rv,I,Trump,FALSE,How would you rate each of the following on their handling of the coronavirus? President Donald Trump,38,54,https://morningconsult.com/wp-content/uploads/2020/03/2003101_crosstabs_POLITICO_RVs_v1_AUTO.pdf
2020-03-27,2020-03-30,Selzer,Grinnell College,1009,a,all,Trump,FALSE,Do you approve or disapprove of the job Donald Trump is doing: With handling the COVID-19 coronavirus situation?,50,43,https://www.grinnell.edu/sites/default/files/docs/2020-03/GCNP%20April%202020%20Toplines%20and%20Methodology.pdf
2020-03-27,2020-03-30,Selzer,Grinnell College,333,a,R,Trump,FALSE,Do you approve or disapprove of the job Donald Trump is doing: With handling the COVID-19 coronavirus situation?,86,10,https://www.grinnell.edu/sites/default/files/docs/2020-03/GCNP%20April%202020%20Toplines%20and%20Methodology.pdf
2020-03-27,2020-03-30,Selzer,Grinnell College,396,a,D,Trump,FALSE,Do you approve or disapprove of the job Donald Trump is doing: With handling the COVID-19 coronavirus situation?,24,72,https://www.grinnell.edu/sites/default/files/docs/2020-03/GCNP%20April%202020%20Toplines%20and%20Methodology.pdf
2020-03-27,2020-03-30,Selzer,Grinnell College,237,a,I,Trump,FALSE,Do you approve or disapprove of the job Donald Trump is doing: With handling the COVID-19 coronavirus situation?,42,47,https://www.grinnell.edu/sites/default/files/docs/2020-03/GCNP%20April%202020%20Toplines%20and%20Methodology.pdf
2020-03-27,2020-03-31,YouGov,Huffington Post,1000,a,all,Trump,FALSE,Do you approve or disapprove of the way President Trump is handling issues related to the coronavirus?,50,45,https://big.assets.huffingtonpost.com/athena/files/2020/04/02/5e861523c5b6a9491832d32d.pdf
2020-03-27,2020-03-31,YouGov,Huffington Post,236,a,R,Trump,FALSE,Do you approve or disapprove of the way President Trump is handling issues related to the coronavirus?,88,11,https://big.assets.huffingtonpost.com/athena/files/2020/04/02/5e861523c5b6a9491832d32d.pdf
2020-03-27,2020-03-31,YouGov,Huffington Post,378,a,D,Trump,FALSE,Do you approve or disapprove of the way President Trump is handling issues related to the coronavirus?,24,75,https://big.assets.huffingtonpost.com/athena/files/2020/04/02/5e861523c5b6a9491832d32d.pdf
2020-03-27,2020-03-31,YouGov,Huffington Post,382,a,I,Trump,FALSE,Do you approve or disapprove of the way President Trump is handling issues related to the coronavirus?,47,43,https://big.assets.huffingtonpost.com/athena/files/2020/04/02/5e861523c5b6a9491832d32d.pdf
2020-03-27,2020-04-01,Global Strategy Group/GBAO/Navigator Research,"",1010,rv,all,Trump,TRUE,Do you approve or disapprove of the way that Donald Trump is handling the coronavirus pandemic?,48,48,https://navigatorresearch.org/wp-content/uploads/2020/04/Navigator-Daily-Tracker-Topline-F04.01.20.pdf
2020-03-27,2020-04-01,Global Strategy Group/GBAO/Navigator Research,"",363.6,rv,R,Trump,TRUE,Do you approve or disapprove of the way that Donald Trump is handling the coronavirus pandemic?,86,12,https://navigatorresearch.org/wp-content/uploads/2020/04/Navigator-Daily-Tracker-Topline-F04.01.20.pdf
2020-03-27,2020-04-01,Global Strategy Group/GBAO/Navigator Research,"",424.2,rv,D,Trump,TRUE,Do you approve or disapprove of the way that Donald Trump is handling the coronavirus pandemic?,17,80,https://navigatorresearch.org/wp-content/uploads/2020/04/Navigator-Daily-Tracker-Topline-F04.01.20.pdf
2020-03-27,2020-04-01,Global Strategy Group/GBAO/Navigator Research,"",222.2,rv,I,Trump,TRUE,Do you approve or disapprove of the way that Donald Trump is handling the coronavirus pandemic?,43,39,https://navigatorresearch.org/wp-content/uploads/2020/04/Navigator-Daily-Tracker-Topline-F04.01.20.pdf
2020-03-28,2020-03-30,Civiqs,Daily Kos,1505,a,all,Trump,FALSE,Do you approve or disapprove of the way Donald Trump is handling the response to the coronavirus?,44,51,https://civiqs.com/documents/Civiqs_DailyKos_monthly_banner_book_2020_03B_x2nf9sb.pdf
2020-03-28,2020-03-30,Civiqs,Daily Kos,406.35,a,R,Trump,FALSE,Do you approve or disapprove of the way Donald Trump is handling the response to the coronavirus?,89,7,https://civiqs.com/documents/Civiqs_DailyKos_monthly_banner_book_2020_03B_x2nf9sb.pdf
2020-03-28,2020-03-30,Civiqs,Daily Kos,496.65,a,D,Trump,FALSE,Do you approve or disapprove of the way Donald Trump is handling the response to the coronavirus?,8,87,https://civiqs.com/documents/Civiqs_DailyKos_monthly_banner_book_2020_03B_x2nf9sb.pdf
2020-03-28,2020-03-30,Civiqs,Daily Kos,602,a,I,Trump,FALSE,Do you approve or disapprove of the way Donald Trump is handling the response to the coronavirus?,43,49,https://civiqs.com/documents/Civiqs_DailyKos_monthly_banner_book_2020_03B_x2nf9sb.pdf
2020-03-28,2020-04-04,Firehouse Strategies/Øptimus,"",2219,a,all,Trump,TRUE,"In general, do you approve or disapprove of President Donald Trump’s handling of the coronavirus outbreak?",46.6,53.3,https://github.com/optimus-forecasting-and-polling/Firehouse-0ptimus-Coronavirus-Tracking/tree/master/April-13-2020
2020-03-29,2020-03-31,YouGov,Economist,1500,a,all,Trump,FALSE,Do you approve or disapprove of Donald Trump’s handling of the coronavirus outbreak?,50,42,https://docs.cdn.yougov.com/p8nwhxp50n/econTabReport.pdf
2020-03-29,2020-03-31,YouGov,Economist,399,a,R,Trump,FALSE,Do you approve or disapprove of Donald Trump’s handling of the coronavirus outbreak?,89,10,https://docs.cdn.yougov.com/p8nwhxp50n/econTabReport.pdf
2020-03-29,2020-03-31,YouGov,Economist,540,a,D,Trump,FALSE,Do you approve or disapprove of Donald Trump’s handling of the coronavirus outbreak?,22,72,https://docs.cdn.yougov.com/p8nwhxp50n/econTabReport.pdf
2020-03-29,2020-03-31,YouGov,Economist,558,a,I,Trump,FALSE,Do you approve or disapprove of Donald Trump’s handling of the coronavirus outbreak?,47,37,https://docs.cdn.yougov.com/p8nwhxp50n/econTabReport.pdf
2020-03-29,2020-04-01,IBD/TIPP,"",1226,a,all,Trump,FALSE,How would you grade his performance:  HANDLING THE CORONAVIRUS SITUATION,43,41,https://projects.fivethirtyeight.com/polls/20200407_National.xlsx
2020-03-29,2020-04-01,IBD/TIPP,"","",a,I,Trump,FALSE,How would you grade his performance:  HANDLING THE CORONAVIRUS SITUATION,34,47,https://projects.fivethirtyeight.com/polls/20200407_National.xlsx
2020-03-30,2020-03-31,Ipsos (online),Reuters,1114,a,all,Trump,FALSE,Do you approve or disapprove about the way Donald Trump is handling the following issues? Coronavirus/COVID-19,48,46,https://www.ipsos.com/sites/default/files/ct/news/documents/2020-04/2020_reuters_tracking_-_core_political_coronavirus_tracker_04_01_2020.pdf
2020-03-30,2020-04-02,Global Strategy Group/GBAO/Navigator Research,"",1008,rv,all,Trump,TRUE,Do you approve or disapprove of the way that Donald Trump is handling the coronavirus pandemic?,48,49,https://navigatorresearch.org/wp-content/uploads/2020/04/Navigator-Daily-Tracker-Topline-F04.02.20.pdf
2020-03-30,2020-04-02,Global Strategy Group/GBAO/Navigator Research,"",362.88,rv,R,Trump,TRUE,Do you approve or disapprove of the way that Donald Trump is handling the coronavirus pandemic?,88,12,https://navigatorresearch.org/wp-content/uploads/2020/04/Navigator-Daily-Tracker-Topline-F04.02.20.pdf
2020-03-30,2020-04-02,Global Strategy Group/GBAO/Navigator Research,"",423.36,rv,D,Trump,TRUE,Do you approve or disapprove of the way that Donald Trump is handling the coronavirus pandemic?,16,81,https://navigatorresearch.org/wp-content/uploads/2020/04/Navigator-Daily-Tracker-Topline-F04.02.20.pdf
2020-03-30,2020-04-02,Global Strategy Group/GBAO/Navigator Research,"",221.76,rv,I,Trump,TRUE,Do you approve or disapprove of the way that Donald Trump is handling the coronavirus pandemic?,44,43,https://navigatorresearch.org/wp-content/uploads/2020/04/Navigator-Daily-Tracker-Topline-F04.02.20.pdf
2020-03-31,2020-04-01,Morning Consult,"",2200,a,all,Trump,FALSE,"Do you approve or disapprove of the job each of the following is doing in handling the spread of coronavirus in the United States? President Donald Trump
",48,45,https://morningconsult.com/wp-content/uploads/2020/04/2003128_crosstabs_CORONAVIRUS_CONTENT_Adults_v2_JB.pdf
2020-03-31,2020-04-01,Morning Consult,"",692,a,R,Trump,FALSE,"Do you approve or disapprove of the job each of the following is doing in handling the spread of coronavirus in the United States? President Donald Trump
",85,11,https://morningconsult.com/wp-content/uploads/2020/04/2003128_crosstabs_CORONAVIRUS_CONTENT_Adults_v2_JB.pdf
2020-03-31,2020-04-01,Morning Consult,"",825,a,D,Trump,FALSE,"Do you approve or disapprove of the job each of the following is doing in handling the spread of coronavirus in the United States? President Donald Trump
",20,75,https://morningconsult.com/wp-content/uploads/2020/04/2003128_crosstabs_CORONAVIRUS_CONTENT_Adults_v2_JB.pdf
2020-03-31,2020-04-01,Morning Consult,"",683,a,I,Trump,FALSE,"Do you approve or disapprove of the job each of the following is doing in handling the spread of coronavirus in the United States? President Donald Trump
",42,45,https://morningconsult.com/wp-content/uploads/2020/04/2003128_crosstabs_CORONAVIRUS_CONTENT_Adults_v2_JB.pdf
2020-03-31,2020-04-01,YouGov,CBS News,2236,a,all,Trump,FALSE,How would you rate the job Donald Trump is doing handling the coronavirus outbreak?,51,49,https://drive.google.com/file/d/1bgUZsCC8uuAtPUlEgfFySkFuKl-oYjDK/view
2020-03-31,2020-04-01,YouGov,CBS News,561,a,R,Trump,FALSE,How would you rate the job Donald Trump is doing handling the coronavirus outbreak?,90,10,https://drive.google.com/file/d/1bgUZsCC8uuAtPUlEgfFySkFuKl-oYjDK/view
2020-03-31,2020-04-01,YouGov,CBS News,708,a,D,Trump,FALSE,How would you rate the job Donald Trump is doing handling the coronavirus outbreak?,18,83,https://drive.google.com/file/d/1bgUZsCC8uuAtPUlEgfFySkFuKl-oYjDK/view
2020-03-31,2020-04-01,YouGov,CBS News,703,a,I,Trump,FALSE,How would you rate the job Donald Trump is doing handling the coronavirus outbreak?,52,48,https://drive.google.com/file/d/1bgUZsCC8uuAtPUlEgfFySkFuKl-oYjDK/view
2020-03-31,2020-04-03,Global Strategy Group/GBAO/Navigator Research,"",997,rv,all,Trump,TRUE,Do you approve or disapprove of the way that Donald Trump is handling the coronavirus pandemic?,47,49,https://navigatorresearch.org/wp-content/uploads/2020/04/Navigator-Daily-Tracker-Topline-F04.03.20.pdf
2020-03-31,2020-04-03,Global Strategy Group/GBAO/Navigator Research,"",358.92,rv,R,Trump,TRUE,Do you approve or disapprove of the way that Donald Trump is handling the coronavirus pandemic?,85,14,https://navigatorresearch.org/wp-content/uploads/2020/04/Navigator-Daily-Tracker-Topline-F04.03.20.pdf
2020-03-31,2020-04-03,Global Strategy Group/GBAO/Navigator Research,"",418.74,rv,D,Trump,TRUE,Do you approve or disapprove of the way that Donald Trump is handling the coronavirus pandemic?,18,79,https://navigatorresearch.org/wp-content/uploads/2020/04/Navigator-Daily-Tracker-Topline-F04.03.20.pdf
2020-03-31,2020-04-03,Global Strategy Group/GBAO/Navigator Research,"",219.34,rv,I,Trump,TRUE,Do you approve or disapprove of the way that Donald Trump is handling the coronavirus pandemic?,37,47,https://navigatorresearch.org/wp-content/uploads/2020/04/Navigator-Daily-Tracker-Topline-F04.03.20.pdf
2020-04-01,2020-04-02,Ipsos (online),ABC News,559,a,all,Trump,FALSE,Do you approve or disapprove of the way Donald Trump is handling the response to the coronavirus (COVID-19)?,47,52,https://www.ipsos.com/sites/default/files/ct/news/documents/2020-04/topline-abc-coronavirus-trend-wave-3.pdf
2020-04-01,2020-04-02,Ipsos (online),ABC News,148,a,R,Trump,FALSE,Do you approve or disapprove of the way Donald Trump is handling the response to the coronavirus (COVID-19)?,91,9,https://www.ipsos.com/sites/default/files/ct/news/documents/2020-04/topline-abc-coronavirus-trend-wave-3.pdf
2020-04-01,2020-04-02,Ipsos (online),ABC News,163,a,D,Trump,FALSE,Do you approve or disapprove of the way Donald Trump is handling the response to the coronavirus (COVID-19)?,9,91,https://www.ipsos.com/sites/default/files/ct/news/documents/2020-04/topline-abc-coronavirus-trend-wave-3.pdf
2020-04-01,2020-04-02,Ipsos (online),ABC News,228,a,I,Trump,FALSE,Do you approve or disapprove of the way Donald Trump is handling the response to the coronavirus (COVID-19)?,45,54,https://www.ipsos.com/sites/default/files/ct/news/documents/2020-04/topline-abc-coronavirus-trend-wave-3.pdf
2020-04-01,2020-04-03,Winston,"",1000,rv,all,Trump,FALSE,Overall would you say that you approve or disapprove of the job Donald Trump is doing in handling the current health situation involving the coronavirus?,47,44,https://www.winningtheissues.org/wp-content/uploads/2020/08/Winning-the-Issues-April-I-2020-National-Survey.pdf
2020-04-01,2020-04-06,Global Strategy Group/GBAO/Navigator Research,"",1003,rv,all,Trump,TRUE,Do you approve or disapprove of the way that Donald Trump is handling the coronavirus pandemic?,48,49,https://navigatorresearch.org/wp-content/uploads/2020/04/Navigator-Daily-Tracker-Topline-F04.06.20.pdf
